url,template_image_url,about,origin,tags,year,last_update_source,other_types
https://knowyourmeme.com/memes/u-mad,https://i.kym-cdn.com/entries/icons/original/000/001/445/umad_.jpg,"""U MAD?"", sometimes written as ""you mad?"" or ""u mad bro?"", is a catchphrase that is often used in discussion threads to imply that someone is losing their temper during the course of an argument, sometimes taunting or baiting other posters into a flamewar. Due to the agitating nature of the phrase, it is often considered a form of trolling.","The phrase ""You mad, 'cause [I'm better than you]"" is a dissing technique found in the context of hip hop music, with its roots in freestyle battling. The phrase can be often heard on ""diss tracks""[1] or songs primarily intended to disparage or insult others (example shown below, left). The first image macro using the phrase featured the Harlem-based rapper Cam'Ron pointing off camera with the overlaid text ""YOU MAD."" The still image came from a segment on the Bill O'Reilly Show (shown below, right) where Cam'Ron appeared with producer Damon Dash to debate whether or not rap was harmful to children in November 2003. DAMON DASH: How do you hurt children by promoting to be an entrepreneur and a CEO and to do right… (CROSSTALK) O'REILLY: Hold it! Hold it! You're looking at a principal… CAM'RON: Why don't you want to let him talk? You mad. You mad. O'REILLY: You won't let me finish. CAM'RON: Where did you start, A Current Affair, right? O'REILLY: No, wrong. CAM'RON: I'm going to get at you in a minute. O'REILLY: You go ahead. You get at me. CAM'RON: I'm going to get at you in a minute.","['catchphrase', 'image macro', ""cam'ron"", '4chan', 'hip hop', 'fox news', 'reverse caption', 'umad', 'reaction image', 'trolling', 'urban dictionary']",2003,2021-04-13,['catchphrase']
https://knowyourmeme.com/memes/doom-paul-its-happening,https://i.kym-cdn.com/entries/icons/original/000/008/273/doom_paul_1.png,"Doom Paul is an image macro and animated GIF series featuring American physician Ron Paul. Originally used to jokingly depict what could happen if Ron Paul was not elected for President during the 2012 elections, the images eventually grew to be used alongside incoming events to jokingly indicate that their arrival will have apocalyptic results. A common catchphrase used in combination with Doom Paul image macros is ""It's Happening!""","In 2009, a user on 4chan's /new/ (news) board posted the first doom paul image after he lost the 2008 republican nomination with the quote ""All is lost"" and ""I told you so."" The user said the Apocalypse was coming and that these were the last days. 4chan soon removed the /new/ board after the founder, Moot, got sick of the racism on the board. The meme vanished for awhile but was soon mirrored on 4chon.net and it's backup /new/ board. Many of the images were created there and remained. Until the founder, Moot, felt bad and recreated the /new/ board, this time dubbing it /pol/ (Politically incorrect). Soon the images were posted again on the newly created /pol/.","['doom', '4chan', 'ron paul', '/new/', 'doom paul', 'the end times', 'apaulcolypse', '/pol/']",2009,2021-05-08,['image-macro']
https://knowyourmeme.com/memes/patrick-bateman-with-an-axe,https://i.kym-cdn.com/entries/icons/original/000/008/301/Patrick_Bateman_With_an_Axe_Banner.jpg,"Patrick Bateman with An Axe refers to a reaction image and image macro of the character Patrick Bateman (played by Christian Bale) from the 2000 film American Psycho swinging an axe with a slight grin. In memes, the still of the scene is typically used when another person says or does something that the other person hates or doesn't agree with. It's also used in Rage Comics as a reaction to proceeding captions, as well as being used as an exploitable where it is photoshopped to include elements from other pop culture references.","The original scene that the image comes from takes place in American Psyco, released on April 14th, 2000.[1] In one of the scenes, Bateman uses an axe to kill one of his victims, which is where the still used in the meme comes from (shown below).[2] Although the exact first meme using the scene is unknown, a reverse image search on TinEye,[3] shows that it first appeared online February 5th, 2008, on the site Taringa[4] but has since been deleted. In memes, the earliest known variant that still exists online was posted in a Fark[5] thread by user drjekel_mrhyde on August 10th, 2009, in the form of a Demotivational Poster (shown below).","['guy', 'with', 'patrick', 'an', 'axe', 'bateman', 'hey paul', 'meme', 'american psycho', 'christian bale', 'movie memes', 'reaction image', 'image macro', 'exploitable', 'drjekel_mrhyde', 'stoinesteanulucian']",2000,2021-02-01,"['exploitable', 'image-macro']"
https://knowyourmeme.com/memes/haters-gonna-hate,https://i.kym-cdn.com/entries/icons/original/000/001/945/haters.jpg,"Haters Gonna Hate is a catchphrase used to indicate a disregard for hostile remarks addressed towards the speaker. This expression has its roots in American hip hop, and spawned an image macro series featuring pictures of celebrities, animals and cartoon characters strutting or posing in a conceited manner.","While not necessarily the direct progenitor of the meme, the phrase ""Haters Gonna Hate"" first appeared in the pop song ""Playas Gon' Play"" by 3LW in the year 2000:","['catchphrase', 'image macro', 'haters', 'ice-t', '3lw', 'disregard', 'dismiss', 'hip hop', 'reverse caption', 'pop culture', 'snowclone', 'phrasal template', 'comments', 'complacency']",2009,2021-01-12,[]
https://knowyourmeme.com/memes/vomit-chan,https://i.kym-cdn.com/entries/icons/original/000/007/839/f5753870a40ccef114a6cb88e7f48531.jpg,"""Vomit-Chan"" is the nickname given to a fanart of Madotsuki, the main character of the indie japanese RPG Yume Nikki, attempting to contain her vomit. The drawing has been often used as reaction image to express disgust towards someone's opinion or facts, in adittion to its use as exploitable template.","The original image was drawn by the Pixiv artist 蒼天空 (Aosora),[2] known for his drawings featuring guro, and originally posted on July 7th, 2010 under the title ""★嘔吐★"" (Vomiting).[3] The original image can't longer be found on his account. From the same collection of drawings that feature Madotsuki (also removed from his account), four of them were also adopted as reaction images, without meeting the popularity of ""Vomiting"". The image of her taking pills usually denotes depressing subjects while the one of her going crazy usually depicts that something is either so terrible that the user can't believe it, or that something is slowly driving the user crazy.","['/a/', 'yume nikki', 'madotsuki', 'vomit', 'vomit-chan', 'reaction image', '/v/', '/jp/', '4chan', 'reaction:disgust']",2010,2021-04-14,['exploitable']
https://knowyourmeme.com/memes/amazed-face,https://i.kym-cdn.com/entries/icons/original/000/007/762/337.gif,Amazed Face is a rage comic character and reaction image used to express awe over something that is deemed inspiring or impressive.,"Though the original artist of the drawing is unknown, the earliest archived use of it took place on 4chan's /a/ (Anime and Manga) image board on March 9th, 2010[1] in a thread about the latest release in the historical romance manga series A Bride's Story. In the thread, an anonymous user replied with the reaction image, though not yet referred to as “amazed face,” to convey excitement in seeing his or her favorite character on the title page.","['rainbow', 'rage comics', 'amazed face', 'reaction image', 'jared leto', 'emotibot']",2010,2019-11-17,[]
https://knowyourmeme.com/memes/doushio,https://i.kym-cdn.com/entries/icons/original/000/007/150/Doushio.png,"Doushio is an image macro series usually featuring a delighted character holding their cheeks in their hands with the phrase captioned on the image; which in Japanese approximately means ""What should I do?""","The original comic was first posted on the daily comics site LOL-COMICS run by illustrator Chris Torres, also known as prguitarman and the creator of Nyan Cat, on December 31st, 2008.[1][2] In the original comic, the character describes how he's going to masturbate during New Years (shown below, left). Around April 2010, an edit of the comic surfaced on 4chan with the text replaced in a scenario where the drawn character is being mistaken as a girl by someone off-screen.[6] The character responds with a tounge-in-cheek response with Japanese phrases and mannerisms. In the last panel, the character holds his cheeks while uttering the phrase ""doushio"" (shown above, right).","['doushio', 'reaction image', 'reaction face', 'reaction', 'cuteness', 'prguitarman', 'chris torres', 'lol-comics']",2010,2019-11-17,[]
https://knowyourmeme.com/memes/why-not-both-why-dont-we-have-both,https://i.kym-cdn.com/entries/icons/original/000/006/759/both.png,"""Why Don't We Have Both?"" is a reaction image that is used in response to various problems that involve choosing between two options or solutions.","The expression ""why don't we have both?"" was originally quoted by a child model in a TV commercial for the Old El Paso at-home taco kit that contains both hard-shell and soft tortillas. In the commercial, a group of Spanish speakers are seen arguing over the quality of hard and soft tacos, to which the girl proposes “Why not both?” with a shrug and puts an end to the debate. Though it is unclear when the commercial first aired, it was discussed online as early as September 2009.[1]","['why', 'tacos', 'both', 'snowclone', 'reaction image']",2011,2021-05-09,['advertisement']
https://knowyourmeme.com/memes/fat-american,https://i.kym-cdn.com/entries/icons/original/000/006/275/Fat_American_Banner.jpg,"Fat American, also known as American Shirt Guy, refers to a viral image of a large American protester wearing a United States flag shirt, who is yelling with a raised fist at an Israeli activist. The image is often used to depict in a negative or humorous way what the stereotypical American looks like, appearing in various image macros or reaction images. The cliche and character are also commonly referenced online or in pop culture.","The image appeared for the first time from the blogging website Lawrence of Cyberia[1] on January 12th, 2004. The title and description of the post were ""Ugly Americans"" and ""Why do they call us that?"" Below the image, there was then specified the location and date in which the event took place, which stated, ""A U.S. woman and supporter of the Israeli security barrier shouts at an Israeli peace activist in Jerusalem on January 2, 2004. (REUTERS/Ronen Zvulun)"" (shown below). The earliest example of the image being used in a meme comes from a post on November 7th, 2009, on Fark,[2] which was posted in a thread by user qwertypoo. The photo mimics the style of a Demotivational Poster with the caption ""America, it's kind of like this"" (seen below).","['usa', 'america', 'asshole', 'obese', 'raised arm', 'screaming', 'israeli', 'shirt', 'italian hand gesture', 'protesters', 'blonde']",2004,2021-01-29,"['character', 'cliche', 'exploitable', 'image-macro', 'pop-culture-reference']"
https://knowyourmeme.com/memes/haters-to-the-left,https://i.kym-cdn.com/entries/icons/original/000/005/926/haters-to-the-left.png,"""Haters to the Left"" is a catchphrase used to direct negative people to leave. It often used in image macros and animated GIFs where people are making pointing gestures. (See also Haters Gonna Hate)","The phrase ""haters to the left"" was first spoken by Kenneth in an episode of the television show 30 Rock titled ""The Source Awards"", which originally aired on March 1st, 2007.","['haters', 'troll', 'trolling', 'swag', 'beyonce']",2007,2019-12-17,[]
https://knowyourmeme.com/memes/are-you-serious-face-seriously,https://i.kym-cdn.com/entries/icons/original/000/005/545/ruserious.jpg,"Are You Serious Face, also known as ""Seriously?"", is a black and white drawing of a perplexed looking man or woman that is often used in rage comics. It is generally used as a reaction to overwhelming ignorance or stupidity.","The original male version of the face was based off a scene where David Silverman of American Atheists makes a perplexed expression during a debate with Bill O'Reilly on Fox News. During the exchange O'Reilly uses the ""tide goes in, tide goes out"" argument for the existence of God that is also the origin of You Can't Explain That image macros. The face is made at about 2:00 into the clip: Silverman: Tide goes in, tide goes out?” O'Reilly: The water, the tide--it comes in and it goes out. It always goes in, then it goes out. … You can’t explain that. You can’t explain it. On January 18th, 2011, a Reddit thread titled ""Do your worst :) (FIXED)"" linked to a black and white drawing of the expression that would later be used in rage comics as the ""are you serious?"" face.[1]","['reddit', 'rage comic', 'david silverman', 'stillshot drawing', 'notables of 2011', 'fox news', 'atheism', 'reaction image']",2011,2021-01-03,[]
https://knowyourmeme.com/memes/costanzajpg-george-costanza-reaction-face,https://i.kym-cdn.com/entries/icons/original/000/005/498/1300044776986.jpg,"Costanza.jpg is a reaction image based on a still image of the Seinfeld character George Costanza (played by actor Jason Alexander) holding a baseball bat with a look of contempt on his face. On 4chan, the image is typically used to express disapproval towards greentext implication posts that would be considered out of social norms. It has also become closely associated with the phrase ""I Seriously Hope You Guys Don’t Do This"" (ISHYGDDT).","Origin: The still shot of George Constanza was taken from the 143rd episode of the American TV sitcom Seinfeld titled “The Abstinence,”[2] which originally aired on November 21st, 1996. While encountering some New York Yankees players at a batting cage, Costanza strikes up a conversation with Bernie Williams and Derek Jeter, who boasts about winning the world series with his team. Constanza responds to Jeter with a smug smile while preparing to swing his bat, coyly replying “Yeah… in six games.” According to Encyclopedia Dramatica[8], the image was first used on 4chan’s /sp/ (sports) board in combination with “>putting ketchup in the fridge,”[9] a greentext phrase used to imply that an activity or choice is abnormal, sometime in early 2011.","['george', '4chan', 'o rly', 'implying', '>implying', 'reaction face', 'costanza', 'seinfeld', 'disapproval', 'contempt', 'sitcom', 'baseball']",2011,2021-05-02,[]
https://knowyourmeme.com/memes/buddy-christ,https://i.kym-cdn.com/entries/icons/original/000/003/384/christ.jpg,"Buddy Christ refers to a scene from the Kevin Smith film Dogma in which a cardinal attempts to rebrand Jesus Christ to attract new converts to the Catholic church. The Buddy Christ is a smiling, cartoonish depiction of Jesus Christ who is holding both hands up and giving the thumbs up and winking.","Buddy Christ first appeared in the film biblical comedy Dogma, which was released on November 12th, 1999.[2] In the film, a cardinal introduces a group of reporters to a rebranded crucifix for the Catholic church, the Buddy Christ.","['christ', 'jesus', 'image', 'exploitable', 'kevin smith', 'madmann']",1999,2020-10-05,['pop-culture-reference']
https://knowyourmeme.com/memes/nopeavi,https://i.kym-cdn.com/entries/icons/original/000/003/048/nopeavi.jpeg,"Nope.avi is a short video clip featuring a BLU Engineer character from Team Fortress 2 saying ""nope."" Because of its abrupt nature, the video is most often used humorously as a negative response or a curt dismissal in discussion forums and comment threads.","""Nope.avi"" was originally created and uploaded by YouTuber Jimbomcb[1] on January 11th, 2010, using Valve's Source Filmmaker software. The clip begins in the Gravel Pit map with a BLU Engineer character approaching the screen, who suddenly stops and utters the phrase ""nope"" while his neck elongates, and ends with the character promptly walking away. The embeddable clip of Nope.avi was quickly adopted by Team Fortress 2 fans who frequent Steam Users' Forums[2] to tell another user ""no"" in a rude manner, oftentimes for comedic effect. According to Team Fortress Wiki:","['team fortress', 'nope', 'nope.avi', 'tf2 team', 'fortress', '2', 'steam', 'team fortress 2', 'engineer', 'no', 'forums', 'disapproval']",2010,2021-04-28,[]
https://knowyourmeme.com/memes/jizz-in-my-pants,https://i.kym-cdn.com/entries/icons/original/000/002/847/jimpcover.jpg,"Jizz In My Pants is a 2008 song by comedy rap group The Lonely Island about prematurely ejaculating in your pants, which was the subject of parodies and remixes that year. Variations of the phrase, including ""I jizzed in my pants,"" saw significant use as a catchphrase in memes, including image macros and reaction images, following the premiere of the song, often alongside images of people with scrunched-up or shocked faces.","On December 6th, 2008, ""Jizz In My Pants,"" a song by ex-Saturday Night Live cast member Andy Samberg's rap group The Lonely Island, premiered on SNL and the SNL YouTube[1] page as an ""SNL Digital Short"" and the song's official music video (shown below). Notably, this is also the first song released by The Lonely Island. The music video features guest appearances by Justin Timberlake, Molly Sims, and Jamie-Lynn Sigler. The video gained over 84 million views in roughly 13 years, reaching a peak position of 72 in the U.S. Billboard Hot 100 in 2009.","['jizz', 'pants', 'music', 'lonely island', 'jimp', 'andy samberg', 'snl', 'jizz in my pants song', 'reaction', 'catchphrase', 'song']",2008,2021-04-23,"['song', 'catchphrase']"
https://knowyourmeme.com/memes/deal-with-it,https://i.kym-cdn.com/entries/icons/original/000/002/686/Deal_with_it_dog_gif.gif,"""Deal With It"" is an expression used as a retort in response to someone's disapproval. It is often associated with image macros and animated GIFs in which the subject wears a pair of sunglasses.","""Deal with it"" as a colloquial phrase has unknown origins. The Idioms and Expressions[1] online database entry for ""deal with it"" defines it as a means of promoting acceptance. In mid-late 2005, Matt Furie, creator of Feels Good Man, posted a webcomic (shown left) on MySpace using the phrase. On SomethingAwful[2], the catchphrase is often used in the web forums and is where the ""smug dog"" animated GIF (shown right) originated but the date it was added is currently unknown. In December 2008, a graphic of Pac-Man captioned with ""I'm Atheist / deal with it"" was uploaded to Bibanon.org,[10] described as ""the source of the 'deal with it' meme"" (shown below).","['4chan', 'image macro', 'gif', 'sunglasses', 'exploitable', 'something awful', 'yospos', 'lets play', 'matt furie', 'reverse caption', 'comment', 'comments', 'complacency', 'mlg']",2010,2021-05-08,[]
https://knowyourmeme.com/memes/facepalm,https://i.kym-cdn.com/entries/icons/original/000/000/554/picard-facepalm.jpg,"Facepalm, also known as ""facepalming,"" refers to the act of placing one's face in one's hands, a form of nonverbal-communication common among many cultures. The action conveys a message of dismay and is often a reaction toward someone's momentary lapse of logic, judgement, or memory. This reaction may be directed toward another person or be self-deprecating. Online, people post images, GIFs and videos of people performing the motion to express embarrassment towards someone else's actions.","The facepalm, as an expression, has existed long before the internet in both human and non-human societies. For example, a 1896 statue entitled ""Caïn"" by Henri Vidal, which resides in Tuileries Garden, Paris, France, was unveiled in 1896 (shown below, left).[1] One of the most famous and widely used variations of the facepalm comes from an episode of Star Trek: The Next Generation, which first aired on February 5th, 1990. The clip shows the character Captain Jean-Luc Picard (played by Patrick Stewart) reacting to a stressful situation by placing his hand on his face (shown below, right). The website Word Spy[2] cites a 2001 message board as the earliest usage of the expression. However, the actual post is no longer available. Therefore, the earliest available usage of the phrase online was posted on February 10th, 2004 by Urban Dictionary [3] user Moondog. They defined the action, ""The act of dropping one's face / forehead into one's hand. Usually accompanied by a 'thunk' or a cr a cry of 'D'oh!' Usually written between asteriks in online conversation, to demonstrate an action."" The post (shown below) received more than 2,500 upvotes.","['gesture', 'catch-phrase', 'image macro', 'disapproval', 'comments', 'jean luc picard', 'reaction image', 'star trek', 'face palm', 'henri vidal', 'johan jacobsen']",2007,2021-04-30,[]
https://knowyourmeme.com/memes/tony-kornheisers-why,https://i.kym-cdn.com/entries/icons/original/000/002/085/Kornheiser_Why.JPG,"Tony Kornheiser's 'Why' is an image macro series featuring a stillshot of American sportscaster Tony Kornheiser and the lower third caption reading ""Why."" In discussion forums and imageboard communities, Kornheiser's pictures are often used as reaction images to patronize others' opinions or viewpoints.","Tony Kornheiser is an American sportswriter and talk show host who is best known as the host of his radio program The Tony Kornheiser Show and the co-host of ESPN’s Pardon the Interruption. According to Encyclopedia Dramatica,[2] the original image of Kornheiser was uploaded on 4chan’s /sp/ board in late 2009, featuring a stillshot of Kornheiser and Michael Wilbon debating the Indianapolis Colts’ decision to rest Peyton Manning in a game against the New York Jets during an episode of Pardon The Interruption. Across the bottom of the screen, the partially visible lower third caption read “Why did the Colts give up?” (shown below). The juxtaposition of Kornheiser’s self-complacent facial expression with the word ‘WHY’ instantly came off as unexpected and humorous, soon derailing the thread from the original topic to photoshopping Kornheiser’s face onto other pictures","['tony kornheiser', 'why', '4chan', '/sp/', 'sports', 'tv personality', 'tony', ""tony kornheiser's"", 'reaction image']",2009,2021-05-11,['image-macro']
https://knowyourmeme.com/memes/fuck-yea,https://i.kym-cdn.com/entries/icons/original/000/001/987/FuckYEA.jpg,"Fuck Yea is a series of four-pane cartoon strips featuring a stick figure looking complacent and confident. Originally posted via /b/ board in February 2010, these cartoons illustrate triumphant moments. This phenomenon can also be seen as the antithesis to Rageguy comics, another four-pane series originating from 4chan circa late 2008.","While the original post is no longer available, Know Your Meme user Stefan published the earliest known version of the meme on February 11th, 2010. The meme features a stick figure playing and winning a level in Guitar Hero (shown below). However, Know Your Meme users previously reported that the meme comes from the /b/ message board, with its earliest appearance being February 11th, 2010.","['4chan', '/b/', 'comic', '4pane', 'exploitable', 'stick figure', 'image macro', 'review#1', 'complacency']",2010,2021-04-05,"['character', 'slang']"
https://knowyourmeme.com/memes/what-do-your-elf-eyes-see,https://i.kym-cdn.com/entries/icons/original/000/000/820/Legolas_What_Do_Your_Elf_Eyes_See_banner.png,"What Do Your Elf Eyes See?, sometimes written as Legolas! What Do Your Elf Eyes See?, is an exploitable image macro taken from the 2002 film The Lord Of The Rings The Two Towers that depicts Legolas overlooking a valley in Rohan while scanning for signs of the missing hobbits. The scene is used in reaction images and GIFs in addition to image macro memes.","The original scene used in the meme comes from the second Lord of the Rings film, The Two Towers, which was released in theaters on December 18th, 2002. During a scene where Legolas, Aragorn and Gimili are chasing down a pack of Uruk-hai that previously captured the hobbits Merry and Pippin in the first movie, Aragorn and Legolas climb a rock outcrop to scan the valley. At one point, Aragorn asks Legolas ""what do your elf eyes see?"" since elves in Middle-earth have better vision than other races, which is where the quote used in memes comes from (shown below). The actual origin of the image used in memes is uncertain, however, the oldest known instance of it appeared on October 14th, 2006, when Facepunch[1] forum member Zeldy created a thread titled ""Legolas! What do your elf-eyes see?"" The thread resulted in many new images made, spanned 11 pages over the course of about a year (examples shown below).[2] This three-panel format became the most widespread use of the scene early on.","['lord of the rings', 'exploitable', 'funny', 'image', 'legolas', 'reaction', 'image macro', 'reaction gif', 'the two towers', 'aragorn', 'meme']",2002,2021-05-06,"['exploitable', 'image-macro', 'pop-culture-reference']"
