url,template_image_url,about,origin,tags,year,last_update_source,other_types
https://knowyourmeme.com/memes/aaaaaaaa,https://i.kym-cdn.com/entries/icons/original/000/000/993/AAAA.jpg,"Aaaaaaaa are a series of image macros and photoshops in which the first letter of the English (or Latin) alphabet ""A"" is nonsensically repeated many times. These images are often used as either a shock reaction or in a shitposting manner to derail threads. The string of text is also often spammed in chat streams or in text-to-speech engines.","On October 17th, 2005, a page titled ""AAAAAAAAA!"" was created on Uncyclopedia,[1] featuring an entire article filled with the letter ""A"" (shown below).","['derail', 'reaction', 'shitposting', 'sticky key', 'keyboard broke', 'yelling', 'shock']",2005,2021-03-19,"['catchphrase', 'copypasta', 'photoshop']"
https://knowyourmeme.com/memes/cornette-face,https://i.kym-cdn.com/entries/icons/original/000/004/155/CornetteFace.jpg,"Cornette Face refers to a photograph of American professional wrestling commentator Jim Cornette wearing a surprised-looking expression, which is often used as a reaction image or as an exploitable photoshop template in wrestling-related communities online.","While the source of the image has not been found, it is rumored to have come from an interview with Cornette held sometime in 2000.[2] According to a thread on GameFAQs (as archived on LurkerFAQs)[2] the reaction image from the interview was originally popularized on the drug enthusiast image board 420 chan (shown below).",['jim cornette wrestling image macro exploitable'],2010,2020-08-19,['character']
https://knowyourmeme.com/memes/impossibru,https://i.kym-cdn.com/entries/icons/original/000/004/918/imposibru.jpg,"Impossibru is a reaction image based on a stillshot of an Asian man wearing a bizarre expression and the caption reading ""impossibru,"" which is typically interpreted as the Engrish equivalent of the word ""impossible"" (Japanese: インポシブル imposhiburu). Both the image and the phrase has been used to express one's surprise or exclamation across various forums and imageboard sites, and is notable as being similar to Rape Face.","The man shown in the original photograph is a Japanese comedian named Ayumu Kato, who became one of many celebrity victims in the popular hidden-camera prank show Panic Face King. In the episode, Kato is introduced to a group of businessmen (played by hired actors) under the premise of a business meeting. But as they begin their conversation, the three businessmen suddenly get shot down in front of him and a man wearing body armor enters the room to fire at the ""snipers"" outside. Kato falls to the floor in panic and moments later, another man enters the room with a gun, puts it to his head and informs him that he'd been punked by the TV show. The clip was uploaded by YouTuber clicktoriscom on January 29th, 2010.","['wtf', 'engrish', 'kato', 'lulz', 'asian', 'impossible', 'crazy', 'ayumu', 'japan', 'sniper', 'impossiburu', 'reaction face', 'ayumu kato', 'panic face king', 'clicktoriscom']",2010,2020-08-27,[]
https://knowyourmeme.com/memes/reaction-images,https://i.kym-cdn.com/entries/icons/original/000/002/684/reactionimage.jpg,Reaction Images are images or animated gifs that are meant to portray a specific emotion in response to something that has been said. They are commonly used in discussion threads in a similar fashion to emoticons.,"Reaction images have their roots in the pictorial representation of facial expressions known as ""emoticons"", with the first recorded instance produced by Scott Fahlman on September 19th, 1982. The exact origin of reaction images is difficult to trace, but it early examples have appeared on Futaba Channel (2chan) and 4chan. One of the earliest known reaction faces is the facepalm, which was first recorded on Urban Dictionary[10] on February 10th, 2004.","['4chan', 'screen', 'cap', 'screencap', 'picture', 'exhibition', 'reaction image', 'gifs', 'gif', 'pics', 'reaction pics', 'reaction pic', 'emoticons', 'internet feelings', 'internet emotion', 'scott fahlman', 'jason eppink', ""dawson's creek"", 'rage comic', 'rage face', ""new york city's museum of""]",2004,2021-05-11,[]
https://knowyourmeme.com/memes/desk-flip,https://i.kym-cdn.com/entries/icons/original/000/006/725/Desk_Flip_banner.jpg,"Desk Flip, also known as Table Flip, is a Rage Comics character depicting a man flipping over his desk in anger, related to the flipping tables trope. Used to convey extreme frustration, Desk Flip is most frequently used as a simple reaction, but also appears as an exploitable image macro in various comics, similar to other Rage Faces.","The exact origin and creator of the face is unknown, although searches for the meme became noticeable around late 2011. The oldest known date tracing back the origins of the Desk Flip character stems from a post on June 18th, 2011, when it was added to the Rage Maker[1] site under the ""Angry"" category (seen below). As with the original post of the Rage Face, the first meme to use Desk Flip is unknown, but on August 18th, 2012, early examples of it being used in such a fashion are found on Meme Generator[2] across numerous image macros (shown below).","['frustration', 'flipping tables', 'reaction image', 'table flip', 'rage comics', 'rage face', 'flipping desk', 'image macro', 'character', 'exploitable', 'reaction']",2011,2021-05-05,"['character', 'exploitable', 'image-macro']"
https://knowyourmeme.com/memes/side-eyeing-chloe,https://i.kym-cdn.com/entries/icons/original/000/014/285/sideeyechloe.jpg,Side Eyeing Chloe is a photoshop meme based on a screen capture of a concerned-looking little girl in a YouTube video of two children reacting to their parents' announcement of a surprise trip to Disneyland that went viral in September 2013.,"On September 12th, 2013, YouTuber KAftC[1] uploaded a video titled ""Lily's Disneyland Surprise… AGAIN,"" which shows two sisters, Lily and Chloe, reacting to the news of a surprise trip to Disneyland on their way to school. As the older sister, Lily, breaks into tears of joy, Chloe is briefly seen on camera with a disturbed look on her face.","['side eyeing chloe', 'reaction image', 'side eye', 'disapproval', 'kaftc', 'yungbasedblogger', 'chloe queen of everything', '@lilyandchloeofficial', '@annacrysti']",2013,2021-01-11,['photoshop']
https://knowyourmeme.com/memes/laughing-tom-cruise,https://i.kym-cdn.com/entries/icons/original/000/016/729/large.jpg,Laughing Tom Cruise refers to a series of photoshopped images and remix videos based on a press photograph of the famous American actor laughing manically during his on-stage appearance as a guest speaker at a Yahoo! conference in early 2006.,"On March 26th, 2006, Flickr[1] user Maximum Mitch uploaded a photo of Tom Cruise manically laughing during a conference at the Yahoo! headquarters[7]. As of October 2014, the photo has gained over 5,000 views.","['image macro', 'exploitable', 'photograph', 'laughing', 'tom cruise']",2006,2021-04-15,[]
https://knowyourmeme.com/memes/getty-images-baboons,https://i.kym-cdn.com/entries/icons/original/000/018/805/getty-baboon.jpg,"Getty Images Baboon refers to a series of short videos (often represented as GIFs) of a baboon or several baboons using office technology on a red background; the images also usually possess a Getty Images watermark. Since their discovery, the videos have been employed as embeddable reaction GIFs, usually on posts relating to feels.","Between December 2011 and February 2012, the photographers GK and Vikki Hart uploaded 48 different videos to Getty Images of a baboon and a group of baboons using office technology, like computers, flip phones, flip charts, and regular telephones. The baboons were depicted sitting at desks and meeting at conference tables. The first instance of the images being removed from the stock photography context and used with the watermark as a humorous reaction image was by tumblr user risingtensions on April 15th, 2014, where a short GIF of the video labeled ""Medium shot baboon holding stacks of money and making faces"" was posted and received 538 notes as of September 1st, 2015.","['getty', 'baboon', 'stock photo', 'stock video', 'twitter', 'digg', 'risingtensions', 'red_45']",2015,2019-10-24,[]
https://knowyourmeme.com/memes/new-york-on-a-bed,https://i.kym-cdn.com/entries/icons/original/000/019/241/enhanced-26298-1432220843-2.jpg,"""New York"" on a Bed refers to a reaction image used to illustrate feelings of impatience or latent rage. The image features ""New York,"" a.k.a. 2000's reality television star Tiffany Pollard, sitting on a bed, fully clothed, wearing sunglasses an an annoyed expression. It is often distributed as accompaniment to That Feel When style posts.","""New York"" is the nickname of Tiffany Pollard, a contestant in both the first and second seasons of the 2006-2007 VH1 reality television show Flavor of Love.[1] The show was a matchmaking show featuring the eccentric rapper Flava Flav, and was well-known for the humorousness of the settings and outrageousness of the characters. New York, who was one of the most outspoken and controversial characters, was later featured in several spinoff series because of her immense popularity.[2] This freeze-frame most likely came from the first season of Flava of Love.","['flavor of love', 'flava flave', 'black twitter', 'new york', 'tiffany pollard', 'bed', 'sitting', 'not having it', 'reaction image', 'mfw', 'mikeshotya']",2015,2020-08-30,[]
https://knowyourmeme.com/memes/hey-thats-pretty-good,https://i.kym-cdn.com/entries/icons/original/000/019/653/thats_pretty_good.jpg,"Hey! That's Pretty Good is a reaction image of YouTuber iDubbbz, from the video DUMBASS GETS PEWDIEPIE TATTOO, which was uploaded on the Filthy Frank channel. The gif gained notoriety from the fans of both YouTubers.","The gif originated from the video DUMBASS GETS PEWDIEPIE TATTOO, from the Filthy Frank channel. In the video, iDubbbz, Frank, and another YouTuber, MaxMoeFoe, force a friend, MonkRage (aka anything4views), to get a PewDiePie tattoo because they drank tequila and made a bet. The clip starts at 1:53","['youtube', 'filthy frank', 'idubbbz', ""that's pretty good""]",2015,2020-07-22,[]
https://knowyourmeme.com/memes/hold-the-door,https://i.kym-cdn.com/entries/icons/original/000/020/555/Screenshot_246.png,"""Hold the Door"" is a quote uttered by Hodor, a recurring character in George R. R. Martin's fantasy novel series A Song of Ice and Fire and HBO's TV series adaptation Game of Thrones, before he sacrificies himself to save Bran Stark from a horde of White Walkers.","The mysterious origin as to how the character earned his name ""Hodor"" has been a subject of intense discussions among the fans of A Song of Ice and Fire and Game of Thrones for many years. On May 22nd, 2016, the backstory was finally revealed in Season 6, Episode 5 of Game of Thrones titled ""The Door."" In the episode, Bran Stark continues his time-traveling journey with the Three-Eyed Raven. Meanwhile, in the present time, a hoard of White Walkers led by the Night King close in on the cave that Bran and his group have been hiding in. As Meera Reed and Hodor prepare their escape, Meera asks Bran to warg, a form of mind-controlling, into Hodor's mind so that he can rescue his unconscious body out of the cave, which Bran obliges by warging into a younger version of Hodor, a cheerful stable boy then known as ""Wylis,"" in the past. As they flee their way out of the cave, Meera pleads Hodor to ""hold the door"" to buy her and Bran enough time to escape safely, a command that echoes through the past into Wylis' head and triggers him to lapse into a state of seizure and ""hold the door!"" over and over again. As Hodor complies with the request in the present time, the character is overrun and killed by the White Walkers while ""holding the door.""","['game of thrones', 'hold the door', 'hodor']",2016,2019-12-21,"['catchphrase', 'pop-culture-reference']"
https://knowyourmeme.com/memes/la-noire-doubt-press-x-to-doubt,https://i.kym-cdn.com/entries/icons/original/000/023/021/e02e5ffb5f980cd8262cf7f0ae00a4a9_press-x-to-doubt-memes-memesuper-la-noire-doubt-meme_419-238.png,"L.A. Noire ""Doubt"", also known as Press X to Doubt, is a reaction image taken from the video game L.A. Noire by Rockstar Games used to express disbelief in a headline or a thread's previous statement.","In the video game L.A. Noire, the player plays as detective Cole Phelps in 1940s Los Angeles.[1] One of the major gameplay features of L.A. Noire are scenes in which Phelps interrogates witnesses to crimes. After a witness makes a statement, the player is presented with three options. The player must choose whether to accept the statement as truthful (""Truth""), express doubt of the witness' statement (""Doubt""), or accuse the witness of lying (""Lie""). An image of Phelps' face looking disbelieving accompanied by the ""Doubt"" prompt became the reaction image (shown below, left). On December 4th, 2012, the image without the caption was posted to Funnyjunk, [2] and the comment accompanying the image was ""(X) Doubt."" This likely was the first iteration of the meme (shown below, right).","['l.a. noire', 'video game', 'reaction image', 'loatheoflaughing', 'rockstar games', 'cole phelps', 'le 43eyes']",2011,2021-04-23,[]
https://knowyourmeme.com/memes/ted-talk-gorilla,https://i.kym-cdn.com/entries/icons/original/000/023/298/DDLCBFmUwAAU7l6.jpg,"TED Talk Gorilla refers to an image of a gorilla from the Los Angeles Zoo who is sitting and gesturing with his mouth open in front of onlookers, making it appear as though he was delivering a lecture.","On July 23rd, 2014, the photo appeared in a press release from the Los Angeles Zoo[3] promoting their ""Brew at the Zoo"" event (shown below). On June 22nd, 2017, the LAist Twitter[4] used the photo to promote the event as one of ""20 Awesome Events Happening In Los Angeles."" Twitter user @nilaffle[5] remarked of the photo, ""This gorilla looks like he decided to have this undergrad philosophy lecture outside since it's a nice day.""","['gorilla', 'zoo', 'ted talk', 'parody']",2017,2021-02-02,[]
https://knowyourmeme.com/memes/chance-the-rapper-bet-awards-reaction,https://i.kym-cdn.com/entries/icons/original/000/023/314/chance.jpg,Chance the Rapper BET Awards Reaction refers to a series of image macros featuring performing artist and music producer Chance the Rapper from the 2017 BET Awards in which Chance is seen smiling and holding his chest. Most of the captions for the picture display wholesome and good hearted reactions.,"At the 2017 BET Awards,[3] Chance the Rapper was filmed holding his chest and smiling. During the the broadcast, Twitter user @YoAdriBaby posted the moment to Twitter with the caption ""I had to rewind to capture Chance in his essence 💛."" The post (shown below) received more than 9,900 retweets and 21,000 likes in three days.[1]","['chance the rapper', 'music', 'rap', 'reaction images', 'credit card', 'relief']",2017,2020-01-14,[]
https://knowyourmeme.com/memes/worried-jay-z,https://i.kym-cdn.com/entries/icons/original/000/023/356/Screen_Shot_2017-07-05_at_1.49.30_PM.jpg,Worried Jay-Z refers to a GIF of rapper Jay-Z bopping his head along to music with an anxious expression on his face. The GIF has been used as a Reaction Image for situations in which one is both enjoying something and worried at the same time.,"The GIF comes from a televised Coldplay concert for the BBC which Jay-Z attended. During the Coldplay song ""Lovers in Japan,"" the camera cut to Jay-Z in the crowd, and the footage captured became the GIF (shown below). A GIF of the moment was posted that day to Soompi[1] by user goodvibrations.","['gif', 'jay-z', 'coldplay', 'ricky gervais', 'reaction image']",2008,2020-01-14,[]
https://knowyourmeme.com/memes/you-stole-my-cloudsong,https://i.kym-cdn.com/entries/icons/original/000/023/535/cloudysongy.jpg,"You Stole My Cloudsong refers to a viral video in which a player in the massively multiplayer online role-playing game Dark Age of Camelot (DAoC) loudly screams ""You stole my fucking cloudsong!"" after another player took a magical Cloudsong cloak from him.","On June 28th, 2005, YTMND user ava11 submitted a page featuring an audio clip of the DAoC player, which gathered upwards of 20,400 views over the next 12 years.[1]","['angry', 'world of warcraft', 'swearing', 'reaction', 'audio file']",2005,2018-07-18,"['remix', 'viral-video']"
https://knowyourmeme.com/memes/notto-disu-shitto-agen,https://i.kym-cdn.com/entries/icons/original/000/023/818/cdc.jpg,"Notto Disu Shitto Agen is a reaction image from the anime Code Geass R2 in which a screencap of the Emperor of Britannia has been photoshopped such that the subtitles of the scene read ""Notto Disu Shitto Agen,"" a poor Japanese-like way of saying ""Not this shit again.""","The screencap comes from episode 20 of the anime Code Geass R2: Lelouch of the Rebellion, ""Emperor Dismissed.""[1] In the episode, the character Lelouch addresses his father, busy imploring gods for assistance, that the gods will not help him. This scene is where the screencap comes from (fan translation of the screencap shown below).","['reaction image', 'code geass', 'anime', 'japanese']",2008,2021-05-03,[]
https://knowyourmeme.com/memes/aaron-paul-screaming,https://i.kym-cdn.com/entries/icons/original/000/023/768/upload.png,"Aaron Paul Screaming is a face made by actor Aaron Paul playing Tobey Marshall, in the 2014 film adaptation of the game franchise Need for Speed. It has become a popular reaction image, particularly on Tumblr in situations where it looks like something cute will be hurt.","Need for Speed was released on March 14th, 2014 in the United States.[1] Near the beginning of the film Tobey and his partner, Little Pete, tries to win a race to pay off a debt. Little Pete ends up being killed during the race. The face is Marshall's reaction to the crash.[2][3] It was captured by MundaneWarrior blogger Jack Forey in a review posted March 20th of that year (shown below).","['need for speed', 'reaction image', 'jesse pinkman screaming', 'breaking bad', 'movies', 'film', 'television']",2014,2021-03-28,[]
https://knowyourmeme.com/memes/lgtm,https://i.kym-cdn.com/entries/icons/original/000/023/701/269.jpg,"LGTM is an acronym for ""Looks Good To Me"" that is primarily used by programmers to express's one approval or favorable feedback during the review process of a software product. While the slang term is believed to have been used by developers since as early as the mid-to-late 2000s, it entered the general lexicon of online coding communities during the early 2010s, particularly on the code repository hosting service Github.","While the story behind the coinage of LGTM remains murky at best, the earliest known use and explanation of the acronym can be traced to a feature summary of Google Mondrian, a peer-review software application for programmers, posted by Niall Kennedy[3] on November 30th, 2006. In explaining the most common method of peer-review, Kennedy mentions how reviewers would typically type in ""LGTM"" to express their approval, especially when communicating via email. Previous to Mondrian code review was conducted largely over e-mail using Google command-line wrappers built on top of Perforce. A developer could initiate a code review from within the g4 mail tool, which would fire off an e-mail and begin a review thread. When the developer receives a response of “looks good to me,” or lgtm for short, they could proceed to checkin.","['github', 'review', 'approval', 'lg', 'life is good', 'trademark', 'tm', 'looks good to me', 'acronym', 'internet slang', 'programmer']",2008,2019-10-30,"['hashtag', 'image-macro', 'slang']"
https://knowyourmeme.com/memes/hey-there-demons,https://i.kym-cdn.com/entries/icons/original/000/023/687/Screen_Shot_2017-08-16_at_2.40.43_PM.jpg,"Hey There Demons refers to a screenshot of an episode of Buzzfeed Unsolved: Supernatural in which a man addresses ghosts that may be in a room with ""Hey there demons, it's me, ya boy."" The shot became a reaction image in jokes where a person casually addresses their mental problems.","On April 7th, 2017, online show Buzzfeed Unsolved: Supernatural uploaded an episode in which the cast investigates Bobby Mackey's Music World, a rumored ""portal to hell."" Late in the episode, cast member Shane Madej goes into a dark room and attempts to address any supposed demons in the room with ""Hey there demons, it's me, ya boy."" The episode has gained over 4.5 million views (shown below).","['buzzfeed supernatural', 'buzzfeed', 'ghost hunting', 'demons', 'reaction image', 'benpllatt', 'shane madej', '_bookshelfie', 'robstza lobsza', 'valeriaguzman']",2017,2021-03-25,['pop-culture-reference']
https://knowyourmeme.com/memes/guess-ill-die,https://i.kym-cdn.com/entries/icons/original/000/023/677/Screen_Shot_2017-08-15_at_11.57.51_AM.png,Guess I'll Die refers to a stock photo of a man in a red sweatshirt shrugging his shoulders. The image grew into a reaction image used in situations where the poster jokingly resigns themselves to death due to a minor inconvenience.,"On October 6th, 2009, the photo was uploaded to iStockphoto[1] by Ann Baldwin. It would later be revealed that the photo is of her husband, Mike Baldwin.[2]","['stock photo', 'old man', 'shrugging shoulders', 'ann baldwin', 'mike baldwin', 'noxyouraveragefangirl', 'cinnamon-swan', 'adam davis', 'funkybug', 'lesmiserablesbians', 'imgayjokes', 'bloodylipservice']",2009,2021-04-23,[]
https://knowyourmeme.com/memes/karsten-warholms-world-championships-reaction,https://i.kym-cdn.com/entries/icons/original/000/023/651/norway.jpg,Karsten Warholm's World Championships Reaction refers Norwegian sprinter Karsten Warholm's reaction to winning the gold medal at the IAAF World Championships in London in August 2017.,"On August 9th, 2017, BBC Sports[1] posted a video on Twitter of Norwegian sprinter Karsten Warholm winning the gold medal at the IAAF World Championships in London. They captioned the post ""Karsten Warholm's reaction to winning gold is absolutely priceless."" The tweet (shown below) received more than 2,800 retweets and 8,200 likes in 24 hours. Karsten Warholm's reaction to winning gold is absolutely priceless. pic.twitter.com/y62qfoRGMd Shortly after, Twitter user @Juanjom76[3] posted a series of screencaps of Warholm grabbing his face in surprise and delight. They captioned the post ""A MEME just born.""","['norway', 'sprinter', 'sports', 'reaction image', 'running', 'olympics', 'scared']",2017,2019-11-17,[]
https://knowyourmeme.com/memes/do-you-have-brain-damage,https://i.kym-cdn.com/entries/icons/original/000/023/605/areoyouwell.jpg,"Do You Have Brain Damage? is an exploitable reaction image based off a panel in the comic Scott Pilgrim Gets It Together, which is typically photoshopped with people and fictional characters from a variety of fandoms online.","On November 14th, 2007, the comic Scott Pilgrim Gets It Together was released, in which the titular protagonist is hit on the head with a ball in volume 4, page 9, leading his love interest Ramona to ask ""Are you well? Do you have brain damage?"" (shown below, left). On June 30th, 2011, the panel was uploaded to Scott Pilgrim's Precious Little Wiki (shown below, right).[3]","['scott pilgrim', 'are you well', 'ramona flowers', 'alflikestoeatcats']",2015,2021-03-28,['photoshop']
https://knowyourmeme.com/memes/box-chan,https://i.kym-cdn.com/entries/icons/original/000/023/601/image_(28).jpg,"Box-chan is a female character, created by imouto#7185 on Discord.","Box-chan was posted to the Random server on Discord on August 3rd 2017. They were posted along with a couple more images of drawings that imouto had drawn with their sister, though no comments were made on any of the drawings other than Box-chan. The character began as a circle imouto had drawn for their sister (most likely just the body), before imouto said that they were going to mess it up, and then, messed it up. The original image featuring Box-chan depicts the character holding out a box and saying, ""box desu"" (with ""desu"" being written in Japanese characters), though other users thought it it said, ""box?"".","['art', 'drawing', 'sketch', 'catchphrase', 'reaction']",2017,2018-07-18,['character']
https://knowyourmeme.com/memes/recontextualized-porn,https://i.kym-cdn.com/entries/icons/original/000/027/146/snowey.jpg,"Recontextualized Porn refers to a series of captioned screenshots from pornographic films which are used as reaction images. Unlike Work-Safe Porn, there is usually no photoshopping with recontextualized porn.","While its unclear where exactly the practice of using porn clips as reaction images started, it first began gaining attention with the Gay Porn as Reaction Images meme, which started on Tumblr and was covered by Buzzfeed[1] on October 20th, 2013 (examples shown below).","['porn', ""oh that's fucking filthy"", 'gay porn as reaction images', ""it's so fucking big"", 'oh fuck put it back in', 'oh fuck yeah spread it', ""i hope mom and dad don't find out"", 'shivam091', 'sienna day', 'fake taxi', 'bandmemes666', '@twodudesinapool', 't1m_the_enchanter', '@ever']",2013,2021-04-26,['parody']
