url,template_image_url,about,origin,tags,year,last_update_source,other_types
https://knowyourmeme.com/memes/sometimes-things-that-are-expensive-are-worse,https://i.kym-cdn.com/entries/icons/original/000/023/491/Screen_Shot_2017-07-24_at_2.33.06_PM.jpg,Sometimes… Things That Are Expensive… Are Worse is a quote from the YouTube series The Gay And Wondrous Life of Caleb Gallo. It grew into a popular reaction image on Tumblr in July of 2017.,"The quote comes from episode 4 of The Gay and Wondrous Life of Caleb Gallo by Bryan Jordan Alvarez. It was posted to YouTube on February 27th, 2017 and has gained over 155,000 views as of July 24th, 2017. The scene in question features the character Freckle talking to Caleb about two guys she invited over to her room the previous night (scene shown below).","['gay', 'lgbt', 'tumblr', 'expensive', 'comparison']",2017,2020-11-25,[]
https://knowyourmeme.com/memes/youre-doing-amazing-sweetie,https://i.kym-cdn.com/entries/icons/original/000/023/455/kim.jpg,"You're Doing Amazing, Sweetie is a memorable quote from the reality television series Keeping Up With the Kardashians. Online, the phrase has been adapted as both a catchphrase and a reaction image with a screenshot from the show featuring Kris Jenner pointing her camera at a nude Kim Kardashian being used to express encouragement.","On November 4th, 2007, the fourth episode of season 1 of Keeping Up With The Kardashians entitled ""Birthday Suit"" premiered.[1] In the episode, after much debate, Kim decides to do a nude photoshoot for the adult magazine Playboy. Her mother Kris escorts her to the shoot, during which she snapped a few photos on her nude daughter and said, ""Kim, you're doing amazing, sweetie."" A post shared by @kardashianvideos on Aug 20, 2016 at 10:40am PDT The moment first appeared online on November 5th, 2014, when BuzzFeed included it on a list entitled ""26 Life Lessons Kris Jenner Taught Us All.[2] Coming in at number nine, the list captions a gif of the moment (shown below) ""but always be a cheerleader for friends and family."" The following year, the outlet included the moment on another list of ""26 Kris Jenner Moments That Make You Laugh Every Time.""[3]","['keeping up with the kardashians', 'kris jenner', 'kim kardashian', 'reaction image', 'buzzfeed', 'e!', 'television', 'playboy']",2007,2021-03-15,['catchphrase']
https://knowyourmeme.com/memes/so-whats-wrong-with-takin-the-backstreets,https://i.kym-cdn.com/entries/icons/original/000/023/409/CfYCZOBW4AAu-ps.jpg,"So What's Wrong With Takin' The Backstreets is a lyric from All Star by Smash Mouth. In mid-July of 2017, an image from the All Star music video with the lyric beneath it became a reaction image popular on Reddit, and variations blocked out letters of the lyric so that they read something else, similar to the evolution of I See You're a Man Of Culture and Now This Looks Like a Job For Me memes.","""All Star"" was released on May 4th, 1999. In the song, one of the lyrics in the first verse is ""So much to do, so much to see, so what's wrong with takin' the backstreets?"" (shown below.) On July 4th, 2017, Instagram user @fvckyoumeme[4] uploaded a screenshot of the lyric to make an anal sex joke in a post that gained over 2,300 likes (shown below).","['all star', 'smash mouth', 'i see you are a man of culture as well']",1999,2021-01-14,[]
https://knowyourmeme.com/memes/oh-fuck-put-it-back-in,https://i.kym-cdn.com/entries/icons/original/000/023/404/6b2.jpg,"Oh Fuck, Put It Back In refers to a screenshot of pornographic actress Riley Reid saying ""Oh fuck, put it back in"" during a scene. It is used out of context as a reaction image to describe situations where something needs to quickly be returned back to where it came from.","According to a Redditor T1m_the_enchanter,[2] the still comes from the Reid film Naughty Book Worms 43. On June 30th, 2017, the first known edit was posted by the Instagram page bandmemes666[1] and related to a mishap that might befall a stage musician (shown below). The post gained over 6,300 likes.","['riley reid', 'porn', 'out of context porn', 'reaction image', 't1m_the_enchanter', 'bandmemes666', 'oopsifartedsorry', 'wacky_x', 'juuulzsantana']",2017,2021-03-29,[]
https://knowyourmeme.com/memes/lets-go-boys,https://i.kym-cdn.com/entries/icons/original/000/023/398/letsgoboys.jpg,"Let's Go Boys refers to a photograph of a mustachioed man wearing perforated sunglasses styled like the flag of the country of India. Underneath the man's face is the caption, ""Let's go boys.""","On March 16th, 2015, the Facebook account ironyisdeaditsmemecemetary posted an screenshot from a Snapchat. The screenshot featured a mustachioed-man wearing perforated sunglass with the flag of India printed on them. Underneath the man's face is the caption ""Let's go boys."" The post (shown below) received more than 30 reactions and 20 shares.[1]","['india', 'cricket', 'sunglasses', 'mustache']",2015,2018-07-18,['image-macro']
https://knowyourmeme.com/memes/spider-man-pointing-at-spider-man,https://i.kym-cdn.com/entries/icons/original/000/023/397/C-658VsXoAo3ovC.jpg,Spider-Man Pointing at Spider-Man refers to an image from the 60's Spider-Man cartoon episode in which two people in Spider-Man costumes are pointing at each other.,"The image comes from episode 19b of the 1967 Spider-Man cartoon, ""Double Identity.""[1] In the episode, a villain attempts to impersonate the titular hero. The earliest known use of the two characters dressed as Spider-Man pointing at each other was an image macro posted February 5th, 2011 on Sharenator[2] in a compilation of 60's Spider-Man images (shown below).","['spider-man', '60s spider-man', 'image macro', 'reaction image', 'sharenator', 'generalshawn', 'stormrdr', 'freddyamazin', 'dualestl']",2011,2021-05-02,['image-macro']
https://knowyourmeme.com/memes/art-gallery-puking,https://i.kym-cdn.com/entries/icons/original/000/023/392/artgallery.jpg,Art Gallery Puking refers to a series of reaction images and exploitables of a man throwing up at an art gallery. The image has been used online to express disgust and as a template to convey opinions on different pictures by photoshopping various artworks into the image.,"On December 26th, 2005, YouTuber kristoferpaetau uploaded a video entitled ""Art Forum accident."" As he explains in the description, ""I started to feel really bad at the opening of the Art Forum 2005 Art Fair in Berlin. And suddenly I couldn't help myself, I had to vomit."" As of July 2017, the video has been viewed more than 7,500 times.[1] Additionally, Kristofer Paetau blogged[2] about the incident on his website Paetau.com. In the post, he uploaded a series of screenshots from the video with captions to describe what was happening.","['art', 'jesus', 'puke', 'barf', 'sick', 'reaction images', 'kristoferpaetau', 'scott scheidly', 'hipsteryisus', 'rebloggy', 'callmemike', 'shycobra', 'megumin']",2005,2021-03-09,"['exploitable', 'photoshop']"
https://knowyourmeme.com/memes/donald-duck-boner,https://i.kym-cdn.com/entries/icons/original/000/023/386/donladboner.jpg,Donald Duck Boner refers to a series of still images and gifs from Disney cartoons that feature Donald Duck with large bump in his mid-section. Many online have pointed out that the placement of the bump makes it appear as though the kid-friendly cartoon character has an erection.,"The most popular iteration of Donald Duck boner, in which Donald stands up-right with his blue hat on, comes from a frame near end of the Disney animated anthology film Saludos Amigos, released August 24th, 1942.[9] During the segment ""Aquarela do Brasil"" (shown below), Donald swallows a bee, and as the bee moves throughout his body, it pushes up against Donald's stomach, creating a bump that resembles an erection. While Donald Duck has been part of the Disney canon since 1934, the earliest known example of the infamous picture of him with a supposed erection online appeared on the helli6n wordpress on August 2nd, 2010.[1] The image has since been removed, but less than a month later, on September 6th, the image (shown below) appeared on Funnyjunk with a watermark from 4gifs.com, meaning it likely dates back farther. Another variation, in which Donald is lying on his back, is a still from the Disney animated short Wide Open Spaces, released September 12th, 1947. In the film, Donald attempts to sleep outside on an air mattress. However, a rock underneath his mattress pushes all the way through his body, creating a bump in his stomach that looks like an erection.","['donald duck', 'disney', 'dolan', 'boner', 'sex', 'penis', 'erection', 'helli6n', 'wide open spaces', 'crosssockdance', 'mcdrawrhumperdink', 'mickey mouse']",1940,2021-05-11,[]
https://knowyourmeme.com/memes/now-this-looks-like-a-job-for-me,https://i.kym-cdn.com/entries/icons/original/000/023/340/lneminme.jpg,"Now This Looks Like a Job For Me refers to an image from the music video for the song ""Without Me"" by Eminem that began being used as a reaction image in late June of 2017 for situations in which the poster volunteers for a task. The jokes tend to be edgy in content and are popular on meme-focused subreddits.","The image in question comes from Eminem's music video or ""Without Me"" (shown below). On June 25th, 2017, Redditor BedlingtonTerrier[1] posted the first known edit to /r/ComedyCemetary, saying that he saw his friend post the edit on iFunny, though it's unclear if that's true. The post gained over 3,200 points (shown below).","['eminem', 'without me', 'edgy', '/r/dankmemes', 'bedlingtonterrier', 'eviljd', 'fingerbangyourfears', '@daviddrubury', '@bricksquad69', '@misscatherinemora']",2017,2021-05-06,[]
https://knowyourmeme.com/memes/laughing-sailor-moon,https://i.kym-cdn.com/entries/icons/original/000/023/323/sailormoon.jpg,"Laughing Sailor Moon is the name given to a still frame from the anime series Sailor Moon, in which the characters Usagi Tsukino and Makoto Kino are shown laughing nervously. Online, the image has been used as exploitable and reaction picture, and often as smug anime face.","The image of Sailor Moon laughing with Sailor Jupiter comes from episode 27 of Sailor Moon season one entitled ""Mercury's Mental Match,[1] which premiered on October 10th, 1992 in Japan and October 11th, 1995 in the United States. During the episode, Usagi and Makoto join the other students in looking at their grades, which have been posted outside their classroom. After Usagi bemoans that she should have worked harder, Makoto suggests that next time she tries studying, causing her and Usagi to laugh nervously.","['sailor moon', 'laughing', 'girls']",1992,2020-06-11,[]
https://knowyourmeme.com/memes/arthurs-headphones,https://i.kym-cdn.com/entries/icons/original/000/023/308/Screen_Shot_2017-06-27_at_2.10.37_PM.png,"Arthur's Headphones refers to an image of Arthur from the animated series Arthur wearing headphones like a human being would. The image became notable as people realized that the headphones were not covering his ears at all, as they are on the top of his head. It grew into a reaction image used in reference to situations where one is not listening to something.","The image comes from the season 17 episode of Arthur, “Binky’s Music Madness,"" which first aired in Australia on May 2, 2013.[1] The scene was first uploaded to YouTube on May 8, 2014. It is the same scene that sparked the Binky Listens To meme. On June 21st, 2016, Twitter user @javeauriel[2] uploaded the image and captioned it ""EXPLAIN THIS,"" gaining over 20,000 retweets and 25,000 likes (shown below).","['arthur', 'headphones', 'binky', 'binky listens to', 'reaction']",2016,2020-08-27,[]
https://knowyourmeme.com/memes/skyrim-skill-tree,https://i.kym-cdn.com/entries/icons/original/000/023/247/6cff97b083dbc42d-768x795.jpg,"Skyrim Skill Tree refers to photoshopped reaction images in which a headline about a person doing something is paired with a screenshot of a corresponding skill from the leveling-up system on Skyrim, demonstrating that person's proficiency in said skill. For example, ""Speech: 110"" would be paired with an image of Bill Clinton saying he did not have sexual relations with Monica Lewinsky, showing his proficiency at lying convincingly.","In Skyrim , when a player has enough experience points, they can level up by entering a skill tree system, wherein they spend their experience points on improving a certain skill. On June 18th, 2017, /r/dankmemes user Autistic_Spinning[1] posted the first template, in which a video of an escaped prisoner convincing a police officer he was out jogging is paired with ""Speech: 100"" (shown below). The post gained over 21,300 points.","['skyrim', 'gaming', 'level up', 'speech', 'autistic_spinning']",2017,2021-04-20,"['photoshop', 'pop-culture-reference']"
https://knowyourmeme.com/memes/the-floor-is,https://i.kym-cdn.com/entries/icons/original/000/023/181/Floor_is.PNG,"The Floor Is… refers to an exploitable two-panel photo series featuring showing a person avoiding the floor, as they would in The Floor Is Lava / Hot Lava Game. It has been used to make image macros about actions that one person will try their best to avoid doing.","The original two pics came from Twitter user @princessofwifi,[1] who on April 24th, 2016, posted the two images with a caption about wanting to sleep early, only to sleep very late (shown below).","['floor is lava', 'lava']",2017,2021-05-07,[]
https://knowyourmeme.com/memes/spongebob-cops,https://i.kym-cdn.com/entries/icons/original/000/023/159/osvk2a0b712z.png,"Spongebob Cops refers to a reaction image that grew popular on Reddit in 2017. It features the recurring police characters from Spongebob Squarepants bursting into a home, and is used in response to scenarios where a person needs to be chastised.","On May 12th, 2001, the Spongebob Squarepants episode ""The Smoking Peanut"" premiered in the United States. In the episode, SpongeBob is confronted by policemen who question him on an incident at the Bikini Bottom Zoo. On June 6th, 2017, Redditor Baglez[1] posted the first use of the image to /r/dankmemes, captioned ""when someone posts a one-month old meme."" The post gained over 2,600 points (shown below).","['spongebob', 'reaction', 'police', 'motion blur']",2017,2020-10-28,[]
https://knowyourmeme.com/memes/gay-silence,https://i.kym-cdn.com/entries/icons/original/000/023/137/10273731.jpg,"[Gay Silence] refers to a series of reaction images in which the subject[s] are staring cryptically either at the camera or someone off-screen with the aforementioned caption. In online conversations, the descriptive audio caption is typically used to convey feelings of awkwardness or discomfort in response to any presumptive question or statement about one's own sexual orientation.","One of the most popular variations of the meme features a 1979 interview with American actor, writer and director Jodie Foster.[1] In the interview, an interviewer asks Foster about her dating life, specifically what she looks for in a male partner. However, Foster had yet to reveal that she is a homosexual. Since being uploaded on May 29th, 2014, the video (shown below) has been viewed more than 279,000 times as of June 2017.","['jodie foster', 'gay', 'lgbtq', 'idubbbz', 'lesbian', 'relationships', 'reaction images', '4chan', 'tumblr', 'descriptive noise', 'closed captioning', 'subtitle', 'blueiskewl', 'moschle', 'emgz', 'elanorbate', 'halfdeafmusic']",2015,2020-02-03,[]
https://knowyourmeme.com/memes/y-tho,https://i.kym-cdn.com/entries/icons/original/000/022/978/yNlQWRM.jpg,"Y Tho, an abbreviation of the question ""why though?"", is a popular slang phrase usually asked in a trolling manner in response to a senseless action or statement. It later grew associated with a painting of a round, fat pope with a small face.","The earliest definition of ""Y Tho was posted to Urban Dictionary by licia[1] on February 19th, 2007 (shown below). The phrase later became associated with a painting of Pope Leon X painted by Fernando Botero[2] (shown below, left). On December 12th, 2014, the ""image macro"" version of the painting with the ""Y Tho"" text was uploaded to Imgur (shown below, right), where it gained over 38,000 views.[3] A week later, the image was posted in a thread on /r/funny by user firstwarrior.[4]","['pope', 'art', 'firstwarrior', 'collius', 'kvdence']",2007,2021-01-16,[]
https://knowyourmeme.com/memes/chuck-e-cheese-stare,https://i.kym-cdn.com/entries/icons/original/000/022/686/download.jpg,"Chuck E. Cheese Stare, also known as Awkward Look Mouse, is a reaction image and image macro series featuring photographs of an animatronic Chuck E. Cheese restaurant mascot looking to the side before staring directly at the camera. The images are often used online to convey feelings of shock or terror.","On November 16th, 2014, Tumblr[7] user thehouseofmario posted a video of a Chuck E. Cheese robot suddenly glaring at the camera while being filmed (shown below). Over the next three years, the post garnered more than 126,000 notes.","['animatronic', 'creepy', 'awkward look', 'awkward look mouse', 'double take', 'awkward stare', 'chuck e cheese', 'mouse costume', 'toy mouse', 'scared look']",2014,2020-10-08,['image-macro']
https://knowyourmeme.com/memes/alex-rodriguez-thinking,https://i.kym-cdn.com/entries/icons/original/000/022/568/arod.jpg,"Alex Rodriguez Thinking is a reaction image, referring to a tweet from the former New York Yankee, in which he posted a picture of himself deep in thought under the caption ""Who will win the World Series this year? #mlb.""[1] On Twitter, the image has been widely used to express intense or even painful thinking.","On March 28th, 2017, Alex Rodriguez tweeted a photo of himself thinking with the caption ""Who will win the World Series this year? #mlb."" Within 48 hours, the tweet gained over 2,900 likes and 1,100 retweets.[1]","['baseball', 'twitter', 'tweets']",2017,2019-12-17,[]
https://knowyourmeme.com/memes/run-bitch-run,https://i.kym-cdn.com/entries/icons/original/000/022/546/fuck_off_lol.PNG,"Run, bitch, run! is a quote in the 2000 film, Scary Movie. It is used as a reaction to express distress or a warning to stay away from a certain situation that is deemed too dangerous to go through.","The quote originates from a scene in the film wherein Shorty, one of the main characters of the film, is being interviewed by a press after an incident of murder in his college town (show below). The reporter asks him about ""his last words"" to the murdered victim, Drew. He answers her with the quote in a manner as if he is warning the victim of her inevitable death.","['movie', 'supermarioglitchy4', 'scary movie']",2000,2020-08-25,[]
https://knowyourmeme.com/memes/ah-i-see-youre-a-man-of-culture-as-well,https://i.kym-cdn.com/entries/icons/original/000/022/506/7c6.jpg,"I See You're a Man of Culture is a reaction image featuring a screenshot of the character Last Samurai from the anime Arakawa Under the Bridge with the caption ""Ah, I see you're a man of culture as well."" The image is often accompanied by mock dialogues used to express good taste in a specific hobby or interest. However, some report that the subtitles in the meme are not official.","In Season 2 Episode 9 of Arakawa Under the Bridge, originally aired on November 28th, 2010, the character Last Samurai is shown coyly uttering the phrase ""Ah, I see you are a man of culture as well"" when discussing the top knot hairstyle around 17 minutes into the episode (shown below). On November 16th, 2015, a 4chan user replied to a thread on the /ck/ (cooking) board discussing chain pizza restaurants with a screenshot of the scene (shown below).[8]","['anime', 'arakawa under the bridge', 'screenshot', 'last samurai', 'noodletank', 'shreksanus69', 'assasinlife', 'chrisevans19', 'dankest_memes_m8']",2016,2021-05-02,[]
https://knowyourmeme.com/memes/melenchon-reaction,https://i.kym-cdn.com/entries/icons/original/000/022/498/melenchonreactsthumbnail.png,"Mélenchon Reaction is a reaction GIF featuring french politician and presidential candidate Jean-Luc Mélenchon, which is often associated with various captions describing surprising and unexpected circumstances. The original image emerged from an interview published by french radio network Europe 1 on march 15, 2017, and raised to national fame on Twitter the following days, under the hashtag #melenchonreaction.","On march 15th, 2017, Jean-Luc Mélenchon held an interview with the french radio network Europe 1[1], answering different questions regarding his run for the 2017 french presidential election. However, in a peculiar moment of the interview (video shown below, at 4:18), one of the interview hosts accidentally misnamed Mr. Mélenchon, which caused him to raise his head in an expression of complete astonishement and disbelief, in a fashion reminding Massimo D'Alema or Angry Yellow Diamond's faces. On the same day, Twitter user Mickaël Frison[2] posted an animated GIF version of the video, simply captioning it ""This GIF is going to make my day"" (shown below). Within the next two days, the tweet recieved over 4000 likes and 3900 retweets. Ce GIF va me faire la journée. pic.twitter.com/mytbVv3QWn","['jean luc melenchon', 'melenchon', 'french', 'france', 'election', 'politics', 'reaction image', 'gif', 'presidential election']",2017,2018-07-18,['hashtag']
https://knowyourmeme.com/memes/its-so-fucking-big,https://i.kym-cdn.com/entries/icons/original/000/022/480/Screenshot_2017-03-16_at_18.52.06.png,"It's So Fucking Big is a series of image macros using a still image from a pornographic film of porn star Tori Black with a surprised expression looking upwards to the camera, with a subtitle reading ""It's so fucking big."" The macros follow a formula in which a caption at the top mentions a non-pornographic action, usually showing something innocuous to the woman, prompting her reaction.","The meme originated when Twitter user @twodudesinapool[3] posted the image with the quote ""When you show your date your meme collection"" on February 7th, 2017.","['image macro', 'porn', 'reaction image']",2017,2021-02-20,[]
https://knowyourmeme.com/memes/ryan-gosling-whispering,https://i.kym-cdn.com/entries/icons/original/000/022/333/C5pcisQVMAAXkWT.jpg,Ryan Gosling Whispering refers to jokes about an image of actor Ryan Gosling at the 2017 Academy Awards whispering in the ear of a shocked-looking fan brought on stage by host Jimmy Kimmel.,"At the 2017 Academy Awards, Jimmy Kimmel did a segment where he brought in actual Los Angeles tourists into the Oscars. He brought several to the front of the stage and introduced them to the actors. One of them, identified as Vickie from Chicago, seemed very excited to meet Ryan Gosling. When Gosling shook her hand, he leaned in and said something, and Vickie looked shocked.","['ryan gosling', 'oscars', 'image']",2017,2019-12-17,[]
https://knowyourmeme.com/memes/blinking-white-guy,https://i.kym-cdn.com/entries/icons/original/000/022/255/tumblr_inline_o58r6dmSfe1suaed2_500.gif,"Blinking White Guy, also known as Drew Scanlon Reaction, is a GIF of Drew Scanlon, video editor and podcaster at video game website Giant Bomb. The GIF of Scanlon is used as a reaction image to express incredulity. In August 2019, a multi-panel format based on the GIF known as First Guy To gained popularity.","On December 6th, 2013, an episode of GiantBomb series ""Unprofessional Fridays"" premiered.[5] In the episode, Drew Scanlon performs a ""double take"" reaction when Jeff Gerstmann says ""farming with my hoe"" while playing Starbound (shown below). The earliest known post to use the GIF of Scanlon was a comment by Tokubetsu responding to a comic about Kanye West and Future posted to a NeoGAF thread on July 27th, 2015.[1]","['drew scanlon', 'reaction image', 'gif', 'white guy blinking', 'podcaster', 'kanye west', 'first guy to', 'giant bomb', 'giantbomb', 'jeff gerstmann', 'tokubetsu', '@eksbl']",2015,2021-05-04,[]
https://knowyourmeme.com/memes/mre-tasting-videos,https://i.kym-cdn.com/entries/icons/original/000/022/202/maxresdefault.jpg,"MRE Taste Videos are YouTube videos in which a person tastes and reviews a MRE (Meal, Ready-to-eat), a packaged product made for the United States military.[1] The videos tend to be popular and often end up trending on YouTube.","On April 17th, 2011, YouTube user gschultz9 uploaded a video of his daughter trying an MRE (shown below). The video has gained over 2,300 views and inspired him to record more videos centered around MREs.","['youtube', 'clickbait', 'meals']",2011,2021-04-18,['participatory-media']
https://knowyourmeme.com/memes/sad-tom-brady,https://i.kym-cdn.com/entries/icons/original/000/022/163/sadtombrady.JPG,"Sad Tom Brady refers to an image of New England Patriots quarterback Tom Brady seated on a bench with his head down, which was widely circulated online prior to his team's comeback victory during Super Bowl 51 held in early February 2017.","During Super Bowl 51 on February 5th, 2017, Brady was filmed with his head down on a bench while his team was down 20-0 against the Atlanta Falcons during a FOX broadcast of the event. Immediately after, the Sports Illustrated Twitter feed immediately posted the clip of Brady with the caption ""Tom Brady is sad"" (shown below). Within 24 hours, the tweet gained over 3,700 likes and 1,900 retweets. Tom Brady is sad pic.twitter.com/wCMIqczhXa","['super bowl 51', 'super bowl', 'tom brady']",2017,2018-07-18,[]
