url,template_image_url,about,origin,tags,year,last_update_source,other_types
https://knowyourmeme.com/memes/roll-safe,https://i.kym-cdn.com/entries/icons/original/000/022/138/highresrollsafe.jpg,"Roll Safe is an image macro series featuring a screenshot of actor Kayode Ewumi grinning and pointing to his temple while portraying the character Reece Simpson (a.k.a. ""Roll Safe"") in the web series Hood Documentary. The images are often captioned with various jokes mocking poor decision making and failures in critical thinking.","On June 1st, 2016, the BBC Three YouTube channel uploaded a mini-documentary on the Hood Documentary series, in which the Simpson is shown pointing to his head and smiling after saying that he finds a woman ""beautiful"" because ""she's got good brains,"" joking that she is skilled at performing oral sex (shown below). Within eight months, the video gained over 1.04 million views and 1,300 comments. On November 15th, 2016, the @FootyHumor[1] Twitter feed posted a screenshot of Ewumi pointing at his temple along with a joke about starting a fight with a girlfriend in order to play video games (shown below).","['image macro', 'black twitter', 'reaction', 'thinking', 'think smart', 'be smart', 'rollsafe', ""it's not"", 'if you', 'logic', 'public service announcement', 'psa', 'kayode ewumi', 'reece simpson', 'dieselman25', 'skiplol', 'informationspork', 'black guy thinking meme', '@trapafasa', '@footyhum']",2016,2021-04-23,[]
https://knowyourmeme.com/memes/elmo-rise,https://i.kym-cdn.com/entries/icons/original/000/022/134/elmo.jpg,"Elmo Rise, also known as Hellmo, is a series of images of a crudely designed Elmo from the children's television series Sesame Street.","The earliest known example of the Elmo Rise image was posted on November 1st, 2012 by CakeWrecks.com[1] user Jen. The writer describes the image as, ""if it's wearing the stricken expression of someone who will give you all the candy you want if you please just don't hurt him…then you're probably looking in a mirror. So go have some fun-size Snickers and put your feet up, my friend, because you've earned it.""","['sesame street', 'elmo', 'fire', 'hell', 'evil', 'rise', 'hellmo', 'teruteru666', 'bretty clough', 'stoptouchingmybutt', 'blankstare']",2012,2021-03-24,['image-macro']
https://knowyourmeme.com/memes/winona-ryders-sag-award-reaction,https://i.kym-cdn.com/entries/icons/original/000/022/124/ryderee.JPG,Winona Ryder's SAG Award Reaction refers to various facial expressions made by actress Winona Ryder while standing next to fellow Stranger Things cast member David Harbour during their acceptance speech for winning Best Ensemble Drama at the 2017 Screen Actors Guild Awards (SAG Awards).,"On January 29th, 2017, the cast of Stranger Things was awarded Best Ensemble Drama at the 2017 SAG Awards ceremony in Los Angeles, California. During Harbour's politically-charged acceptance speech, Ryder could be seen making a wide variety of facial expressions (shown below). During the speech, Twitter user @WellsAdams posted screencaptures of Ryder's facial expressions, captioned with ""Winona Ryder is lit AF"" and ""Winona Ryder is ordering a drink on stage"" (shown below).[1][2]","['actress', 'sag awards']",2017,2019-12-17,[]
https://knowyourmeme.com/memes/dont-let-your-kids-watch-it,https://i.kym-cdn.com/entries/icons/original/000/021/942/robbie.jpg,"Don't Let Your Kids Watch It is a memorable quote uttered by Robbie Rotten during a trailer for the third season of the chidlren's television series LazyTown. Memers include the scene in various parody videos on YouTube, ridiculing that the video shown was inappropriate or lewd, or to criticized shows such as Teen Titans GO!","On October 25th, 2012, the trailer for the third season was released on the official LazyTown YouTube channel.[1][2] Robbie appears at 1:15 of the trailer, stating to not let kids watch the show because, ""…before you know it, they're going to be eating SportsCandy and moving and running and jumping and dancing and being healthy,"" before the background pulls back up, showing Stephanie and Sportacus. The post received more than 8 million views in less than eight years (shown below, left). Four years later, on September 16th, 2016, PCDamonD [3] posted a greenscreen version of the scene labled, Robbie Rotten ""Don't let your kids watch it"" Green Screen [4]. The video received more than 800,000 views in less than four years (shown below, right).","['lazytown', 'robbie rotten', 'kids', 'dont', 'fourth wall', 'let', 'your', 'watch', 'it']",2016,2020-09-15,['remix']
https://knowyourmeme.com/memes/ackchyually,https://i.kym-cdn.com/entries/icons/original/000/021/665/DpQ9YJl.png,"Ackchyually refers to an illustration of a neckbeard in which the word ""actually"" is intentionally misspelled so the reader reads it in the phlegmy cadence associated with nerd culture stereotypes. It is usually used as a reaction image to humorously express doubt at hopeful captions.","While it's unclear where the image first appeared, the earliest known use of ""ackchyually"" appeared on Funnyjunk on April 2nd, 2012[1] in a comment by pawnderp on a fan thread about dolan.","['4chan', 'image', 'neckbeard', 'pawnderp']",2012,2021-03-18,[]
https://knowyourmeme.com/memes/math-lady-confused-lady,https://i.kym-cdn.com/entries/icons/original/000/021/464/14608107_1180665285312703_1558693314_n.jpg,"Math Lady / Confused Lady refers to pictures or gifs of Brazilian actress Renata Sorrah[1] playing Nazaré Tedesco in a scene from the telenovela, Senhora do Destino. The pictures are often used as reaction images to express confusion.","Tedesco is a very popular character from the telenovela Senhora do Destino in Brazil. A clip of her intensely thinking about a situation inspired the meme (shown below, left). Because of her comical personality, images of her have been photoshopped into reaction images and image macros. On Facebook, there is a fan page devoted to posting such pictures of her.[2] The earliest known example of the original gif being used as a reaction image is from October 31st, 2013, when UKMix forum poster CrazyCrazy posted the gif with the caption ""I'm sure there is better music to hear while you wait for Beywance…"" (shown below, right).[3]","['math lady', 'confused blonde', 'confused math lady', 'blonde lady', 'renata sorrah', 'telenovela', 'senhora do destino', 'ukmix', 'crazycrazy', 'nazaré tedesco']",2016,2021-05-05,[]
https://knowyourmeme.com/memes/stop-it-get-some-help,https://i.kym-cdn.com/entries/icons/original/000/021/154/image.jpeg,"""Stop It, Get Some Help"" is a quote said by former professional basketball player Michael Jordan in an anti-drug public service announcement (PSA) that originally aired in May 1987. On Vine and YouTube, Jordan's PSA has been widely used as a reaction video to poke fun at cringeworthy media or express disapproval of behaviors and comments by others.","Sponsored by McDonald's and starring Michael Jordan, the anti-drug public service announcement premiered on ABC at the end of the network's anti-drug TV special program Cracked Up that originally aired on May 26th, 1987. In the minute-long video, Jordan urges teenagers to stay away from doing drugs, while pleading those with substance abuse problems to ""stop it"" and ""get some help."" The earliest digital copy of the original video was uploaded by YouTuber EightiesTV on February 4th, 2010.","['michael jordan', 'anti-drug', 'psa']",1987,2020-10-19,[]
https://knowyourmeme.com/memes/press-a-to-let-go,https://i.kym-cdn.com/entries/icons/original/000/020/468/kGpRV5p.jpg,"Press [A] to Let Go is a reaction image featuring a close-up screenshot of the protagonist Link in the video game The Legend of Zelda: The Wind Waker along with instructions for the player to ""Press [A] to let go.""","On April 10th, 2014, Redditor dogHD submitted a screenshot looking up at the character Link in the game The Wind Waker with the caption ""A to let go"" to /r/gaming[6] (shown below). Before the post was archived, it garnered more than 3,500 votes (90% upvoted) and 140 comments.","['video games', 'legend of zelda', 'link', 'reaction image']",2014,2021-02-22,[]
https://knowyourmeme.com/memes/first-time-tasting-reaction-videos,https://i.kym-cdn.com/entries/icons/original/000/017/930/firstimevid.PNG,First Time Tasting Reaction Videos are recordings of people tasting various foods for the first time while providing commentary about the experience.,"The earliest known tasting reaction video was uploaded by YouTuber NinkComPoop on February 9th, 2014. In the video, two British girls consume various American candies and snacks, while reviewing the taste of each (shown below). In the first two years, the video gained over 550,000 views and 2,600 comments.","['youtube', 'video', 'reaction']",2014,2019-12-17,['participatory-media']
https://knowyourmeme.com/memes/breath-in-boi,https://i.kym-cdn.com/entries/icons/original/000/020/309/sponge.jpg,"""breath in Boi"" refers to a pair of images of the character SpongeBob from the series SpongeBob SquarePants clasping his hands together and leaning over. The images often feature image corruption similar to Real Nigga Hours, and are commonly used in shitposting. The images are also commonly used as a reaction image to various instances of people making an unwise decision.","In 2003, Nick.com debuted the Flash game ""SpongeBob Kah Rah Tay Contest."" In the game, SpongeBob SquarePants and Sandy the Squirrel spar in a karate match. Before they fight, SpongeBob bow (shown below). The game is the basis for the image in the meme.[5] The first known use of the pair of images was in a December 22nd, 2015 post in a 4chan [1] /fa/ (fashion) thread about a series of modified images of SpongeBob wearing a pair of boots. The post contained the image along with the words ""WHO DIS NIKKA???"".","['spongebob', 'boi', 'shitposting', 'corruption', 'hands', 'closed', '/fa/', 'icanmaketheworldhappy', 'explodingscrotum.png', 'ghastily', 'dank420memes1337', 'spongebob kah rah tay contest']",2015,2021-01-14,[]
https://knowyourmeme.com/memes/confused-mr-krabs,https://i.kym-cdn.com/entries/icons/original/000/020/001/krabs.jpg,Confused Mr. Krabs refers to a reaction image of the Spongebob Squarepants character Mr. Krabs with a confused expression as the world around him spins. The image is popular as a companion to jokes that indicate the poster is confused.,"On February 24th, 2001, the Spongebob Squarepants episode ""Patty Hype"" premiered in the United States. In the episode, Mr. Krabs is surrounded by a mob of angry residents after they experienced unintentional side affects of Spongebob's invention. As of March 2016, there is no true clip of this episode available online. On January 31st, 2016, Twitter user isthatahmed tweeted an image from the episode with added motion blur and the caption ""When you just wake up from a nap and your parents already yelling at you"". By March 9th, 2016, the tweet had received 6,352 retweets and 7,370 likes.[2]","['mr krabs', 'krabbie patties', 'spongebob squarepants', 'confused mr krabs', 'twitter', 'black twitter', 'black people twitter', 'reaction image', 'motion blur', 'isthatahmed', 'worldstarhiphop', 'freddyamazin', 'justgoblaze']",2016,2021-01-21,[]
https://knowyourmeme.com/memes/its-time-to-stop,https://i.kym-cdn.com/entries/icons/original/000/019/785/it's_time_to_stop_0-7_screenshot.png,"""It's Time to Stop"" is a memorable quote uttered by YouTube personality Filthy Frank in an exploitable green screen video that was uploaded in late December 2015. The video, which shows Filthy Frank walking into a green screen set with an oversized clock and yelling out the phrase, has inspired a series of remix videos from his fans.","The green screen videos come from a video uploaded on December 24, 2015 by one of the alternate channels of Filthy Frank, saying that many people had asked him for greenscreens, leading to him uploading various greenscene shots to the channel and to his website for free use. The most popular greenscreen is the ""It's Time to Stop"" shot, which has Frank shaking a large clock repeatedly saying ""It's time to stop"", which received over 900,000 views in the following two months.","['filthy frank', 'edit', 'video', 'greenscreen', 'remix', 'stop', 'green screen', 'photoshop', 'reaction image']",2015,2021-05-04,['catchphrase']
https://knowyourmeme.com/memes/michelangelo-open-mouthed-stare-reaction,https://i.kym-cdn.com/entries/icons/original/000/027/747/michelangelo.jpg,"Michelangelo Open-Mouthed Stare Reaction refers to a reaction image macro of the fictional character Michelangelo from the Teenage Mutant Ninja Turtle with his mouth and eyes wide open. The image is used to signify intense anger, surprise or frustration. Additionally, the image has been used as a vibrating GIF, and in the memes What Rhymes With Rape and ""Cowabunga It Is.""","The original image is rumored to have come from the fourth episode of the television series Power Rangers in Space, a crossover episode between the Power Rangers and the Teenage Mutant Ninja Turtles, which aired on February 27th, 1998 (portions of episode below, left).[1][2] On August 6th, 2012, an anonymous 4chan [3] user posted a vibrating GIF of the image in a thread about the anime series Space Battleship Yamato (shown below, right),","['what rhymes with turtle', 'vibrating ninja turtle', 'teenage mutant ninja turtles', 'power rangers', 'television', 'movies', 'comic books', 'ninja turtles reaction images']",2012,2020-10-25,['image-macro']
https://knowyourmeme.com/memes/when-your-parents-ask-where-all-your-money-went,https://i.kym-cdn.com/entries/icons/original/000/019/588/No_idea.jpg,"""When Your Parents Ask Where All Your Money Went"" is a series of reaction images based on a photograph of American actor Zac Efron shrugging with a smile that bears resemblance to the emoticon I Dunno LOL ¯\(°_o)/¯, indicating that the allowance has been already spent in shopping.","The pictures of Zac Efron were taken for the promotion of the 2007 Disney TV musical film High School Musical 2 in which the actor reprises the male lead role Troy Bolton. The original images can be found on the online catalog of movie stills MovieStillsDB.[1] Tweets using the pictures of Efron in combination with the phrase first began appearing in early October 2015, with the earliest known tweet posted by the @ColIegeStudent,[2] a novelty account build around the Advice Animal character Lazy College Senior, on October 2nd. The tweet combined the images with the phrase ""When you're a college student and your parents ask where all your money went."" As of January 17th, 2016, the Tweet has received over 15,000 retweets and 17,000 likes. When you're a college student and your parents ask where all your money went pic.twitter.com/7IU7DK3A3A — College Student (@ColIegeStudent) October 2, 2015","['money', 'high school musical', 'zac efron', 'troy', 'reaction', 'twitter', 'tumblr']",2015,2021-05-03,[]
https://knowyourmeme.com/memes/trying-to-hold-a-fart-next-to-a-cute-girl-in-class,https://i.kym-cdn.com/entries/icons/original/000/019/484/n08A8NO.jpg,"""Trying to Hold a Fart Next to a Cute Girl in Class"" is a reaction image featuring a male student sitting in a classroom while wearing a strained, red-faced facial expression. The picture is often captioned with humorous frustrations or uncomfortable situations.","On March 2nd, 2014, Redditor aaduk_ala submitted a photograph titled ""Trying to hold a fart next to a cute girl in class"" to the /r/funny[1] subreddit (shown below). Prior to being archived, the post gained over 2,500 votes (88% upvoted) and 500 comments.","['reddit', 'imgur', 'fart', 'hold in', 'vein', 'reaction image', 'mfw', 'aaduk_ala', 'ladbible', 'hiddenwarrior', 'michael mcgee', 'holding breath boy', 'holding breath']",2014,2021-02-24,[]
https://knowyourmeme.com/memes/smh,https://i.kym-cdn.com/entries/icons/original/000/019/399/9e4445d0-9ffd-0132-a2d2-0e6808eb79bf.gif,"*SMH"" is an initialism for ""shaking my head,"" which is typically used in text messaging and online discussions to convey feelings of disappointment or dismay in a similar vein to the facepalm.","On February 14th, 2004, Urban Dictionary[1] user trickologist submitted an entry for ""smh,"" defining it as an acronym for ""shake my head"" which is used in response to ""something so stupid, no words can do it justice"" (shown below). Over the next 11 years, the definition gained over 20,100 up votes and 10,400 down votes.","['initialism', 'acronym', 'abbreviation', 'slang', 'reaction image']",2004,2018-07-18,[]
https://knowyourmeme.com/memes/but-thats-wrong-you-fucking-retard,https://i.kym-cdn.com/entries/icons/original/000/018/766/1420483464298_(1).png,"But That's Wrong You Fucking Retard is an exploitable meme and reaction image series typically featuring a close-up of a character with a patronizing expression on their face, captioned with either the phrase ""But that's wrong, you fucking retard"" or a variation thereof.","The image most likely originated on 4chan at some point before 2009; on September 20th, 2009, the Tumblr ""epic4chan"", a blog dedicated to posting images from 4chan, uploaded the first known instance of the meme in a post titled ""But that’s wrong you fucking retard (Bill Nye the Science Guy)"".[1] The post featured a picture of prominent science educator Bill Nye looking at the viewer.","['bill nye', 'reaction image', 'retard', ""but that's wrong"", 'exploitable']",2009,2020-08-16,['exploitable']
https://knowyourmeme.com/memes/ow-the-edge,https://i.kym-cdn.com/entries/icons/original/000/018/681/Ow_the_edge.jpg,"""Ow The Edge"" is a catchphrase used in response to images, videos or posts that seem to fit in the edgy stereotype. The line has been heavily associated to the Sonic the Hedgehog character Shadow the Hedgehog and the 2005 video game of the same name, and inspired a series of Expand Dong-styled images.","The earliest instance of the catchphrase comes from a block thread on 4chan's video game board /v/, where users try to highlight some words or sections from video games covers by blocking parts of it. A post made on September 22nd, 2012 featured an edited version of the 2005 video game Shadow the Hedgehog cover, highlighting the words ""OW THE EDGE"".[3]","['shadow the hedgehog', 'edgy', 'catchphrase', 'shadow', 'u r mr gay', 'expand dong', 'why', ""tony kornheiser's"", 'skeluigi']",2012,2021-04-13,['catchphrase']
https://knowyourmeme.com/memes/how-do-you-do-fellow-kids,https://i.kym-cdn.com/entries/icons/original/000/018/666/fellowkids.jpg,"""How Do You Do, Fellow Kids?"" is a reaction image commonly used to respond to users pretending to be part of a community that they are clearly unfamiliar with. The image features the actor Steve Buscemi dressed youthfully and holding a skateboard, and is usually subtitled with the tag line. The image is often photoshopped to adapt to a particular subculture, and the phrase is often used in conversation without the image.","On February 16th, 2012, the 30 Rock episode ""The Tuxedo Begins"" (season six, episode 8). In the show, actor Steve Buscemi plays Lenny Wosniak, a private detective hired as a strike buster.[1] In a scene where Wosniak is describing his prior investigations, he flashes back to a scene where he believes he successfully masqueraded as a high school student, parodying the TV show 21 Jump Street.[12] Buscemi, a 55-year-old at the time the episode aired, approaches a group of high school teens dress as a ""one of them."" However, his grizzled appearance in contrast with his silly approximation of high school attire, which includes a backwards hat, a skateboard worn over his shoulder and a t-shirt that reads ""Music Band"" in the style of the classic AC/DC logo, is indicative of his poor and obvious disguise. As he approaches, he says, ""How do you do, fellow kids?"" The catchphrase has since come to represent all egregious attempts at appealing to subcultures.","['steve buscemi', '30 rock', 'high school', 'private detective', 'blending in', 'tumblr', 'gif', 'reaction image', 'music band', 'three_am', 'dillonfbecker', 'urplescurple', 'bosoxdanc', 'kaitlyn tiffany']",2012,2021-04-26,"['catchphrase', 'photoshop']"
https://knowyourmeme.com/memes/kocoum-reaction-gifs,https://i.kym-cdn.com/entries/icons/original/000/018/361/kocoum.jpg,"Kocoum Reaction GIFs refers to a series of reaction images based on a scene featuring the titular supporting character from the 1995 Disney animated film Pocahontas wherein Kocoum is shown running and screaming in dismay upon seeing his bride-to-be Pocahontas and John Smith kissing in a forest. Similar to other well-known reaction GIF memes, these images are often featured in My Reaction When style posts, especially on the image-sharing community Imgur.","Disney's 33rd animated feature film Pocahontas was released June 23rd, 1995. In one of the climactic scenes, Pocahontas, the main character and the princess of the Powhatan tribe, kisses John Smith, the 16th-century English explorer captured by her people, in a forest. Upon seeing the two kiss, Kocoum, the tribe's second-in-command warrior that Pocahontas was supposed to be marrying, hurls himself into John Smith while letting out a battle scream in a jealous rage.[1] Reddit user ajaxknight remade the scene in a high quality GIF on February 1st, 2014.[2]","['kocoum', 'pocahontas', 'disney', 'princes', 'princess', 'reaction gif', 'kocouming', 'ruinedeye', 'ajaxknight', 'dorkly', 'bigj76']",2015,2021-03-23,[]
https://knowyourmeme.com/memes/babies-eating-lemons,https://i.kym-cdn.com/entries/icons/original/000/018/174/Screen_Shot_2015-06-04_at_1.06.47_PM.png,Babies Eating Lemons refers to a series of prank videos wherein parents film themselves feeding lemons or limes to their babies and capture their sour-faced reactions on footage.,"Homemade videos of babies reacting to the sour taste of citrus fruits began circulating online during the early days of YouTube in 2006, with the earliest instance uploaded by YouTuber Stinkerbella on July 8th (shown below). Titled “Baby Eats a Lime,” the video recording features a baby named Holiday at her first birthday party where her parents claim she loves lime. As Holiday eats the lime, she makes a series of funny puckered faces. As of June 2015, the clip has accumulated more than 2.8 million views.","['baby', 'lemons', 'limes', 'sour faces', 'video']",2006,2019-12-17,['participatory-media']
https://knowyourmeme.com/memes/i-bet-the-jews-did-this,https://i.kym-cdn.com/entries/icons/original/000/017/995/damn_fb_100790.jpg,"""I Bet The Jews Did This"" is an ironic catchphrase used to mock anti-semitic conspiracy theorists and trolls who blame the people of Jewish descent for their own personal woes and misfortunes. The phrase, along with its snowclone variants, is often featured in a series of reaction images based on a stock photo of a middle-aged man struggling to untangle a messy cluster of Christmas decoration lights, in a similar vein to the combination of infomercial FAIL GIFs and the phrase Thanks, Obama!.","The original image macro (pictured below) is based on a stock photograph of an angry looking man holding tangled Christmas lights[4]. On May 28th, 2009, the earliest known instance of the captioned image macro was posted to 4chan's /b/ (random) board.[1]","['stock photo', 'i bet the jews did this', 'reaction image', 'satire', 'antisemitism', 'judaism']",2009,2021-03-14,[]
https://knowyourmeme.com/memes/crying-michael-jordan,https://i.kym-cdn.com/entries/icons/original/000/017/966/jordan-crying.jpg,"Crying Michael Jordan is a photoshop meme based on a cutout image of former professional basketball player Michael Jordan crying during his 2009 Basketball Hall of Fame induction speech. Online, the image of the tearful Jordan has been frequently used by sports fans to convey sadness in reaction to the defeat of their favorite teams.","On September 11th, 2009, Jordan gave a speech during his Basketball Hall of Fame induction in Springfield, Massachusetts. Throughout the speech, Jordan repeatedly cried while retelling various anecdotes about his career (shown below).","['crying michael jordan', 'michael jordan crying', 'crying jordan', 'jordan crying', 'michael jordan', 'hall of fame', 'hall of fame speech', 'sad michael jordan', 'mj cry', 'sports', 'basketball', 'springfield', 'massachusetts', 'basketball hall of fame', 'memecrunch', 'mjsadfaces', 'est']",2009,2021-03-15,['photoshop']
https://knowyourmeme.com/memes/let-the-hate-flow-through-you,https://i.kym-cdn.com/entries/icons/original/000/017/886/download.jpg,"Let The Hate Flow Through You is a memorable quote uttered by Emperor Palpatine, the main antagonist of the Star Wars franchise, in the 1983 science fiction film Star Wars Episode VI: Return of The Jedi. In online conversations, the quote is typically used in the form of a reaction image as a bait to further incite anger or aggravate those engaged in flame wars or other arguments of hostile nature.","In the film, main antagonist Emperor Palpatine attempts to persuade main protagonist Luke Skywalker to join The Dark Side. The Emperor tells Luke that being on the Dark Side is a good way to feel justified for enacting vengeance. ""Let the hate flow through you,"" is a line from this scene.","['palpatine', 'darth sidious', 'the emperor', 'star wars', 'quote', 'image macro', 'reaction image', 'star wars episode vi: return of the jedi', 'emperor palpatine', 'luke skywalker']",1983,2020-03-31,[]
