url,template_image_url,about,origin,tags,year,last_update_source,other_types
https://knowyourmeme.com/memes/im-commander-shepard,https://i.kym-cdn.com/entries/icons/original/000/002/105/shepcover.jpg,"I'm Commander Shepard, and This Is My Favorite Store on the Citadel is a popular line of dialogue spoken by Commander Shepard in the 2010 Bioware video game Mass Effect 2 when giving an endorsement to an in-game store in exchange for a discount. The line became a popular catchphrase in Mass Effect memes including image macros, in snowclone Advice Animal style memes and YouTube remixes the year of the game's release.","On January 26th, 2010, the second entry in the Mass Effect series of video games, Mass Effect 2, was released in North America. Early in the game, the player character Commander Shepard is given the option to advertise for their favorite store to get discounts from it. If the player chooses to do so, Shepard is recorded by the shop clerk saying, ""I'm Commander Shepard, and this is my favorite store on the citadel."" The player can do this at multiple stores, resulting in the audio clip playing whenever you enter one, humorously making it appear as if Shepard endorses every store as their favorite. On February 4th, 2010, YouTuber[1] DigBickPlaya uploaded footage of the scene, garnering over 130,000 views in 11 years (shown below).","['mass effect', 'shepard', 'store', 'citadel', 'paragon', 'commander shepard', 'bioware', 'ea', 'gaming', 'video games', 'image macro', 'catchphrase', 'snowclone']",2010,2021-04-05,"['catchphrase', 'image-macro']"
https://knowyourmeme.com/memes/but-can-it-run-crysis,https://i.kym-cdn.com/entries/icons/original/000/002/038/maxresdefault.jpg,"But Can It Run Crysis? is a phrase referring to the 2007 Crytek first-person shooter Crysis, underscoring the reputation the game has obtained for it's steep system requirements at the time of its release. The phrase has slowly evolved into a snowclone as years pass, substituting ""But can it run X?"" for the most recent and system-demanding title at the time.","Crysis was released on November 13th, 2007[1] by Crytek and Electronic Arts, and was developed on the (then) latest version of the CryEngine, which also powered Crytek's first title, FarCry. It was amongst the first games to ever utilize Microsoft's DirectX 10 API framework, which required Windows Vista or later. Other feats prided by the Crytek developers was the game being created with over 1 million lines of code, utilization of over 1 GB of texture data, and up to 85,000 active shaders. Since it's release, Crysis has received universal acclaim, hailing it as the first true next-gen gaming experience, with a Metacritic[2] aggregated score of 91 and multiple game of the year awards.   One of the earliest uses of the phrase comes from the bit-tech.net[3] article on the game posted December 15th, 2009, stating that ""The question 'Yeah, but can it play Crysis?' [has become] a comical catchphrase addition to most graphics card reviews."" The article also questions the necessity of such taxing features on the game at release, and if this was a step in the right direction for gaming.","['video games', 'crysis', 'crytek', 'electronic arts', 'first person shooter', 'graphics', 'pc']",2007,2021-04-04,"['catchphrase', 'pop-culture-reference']"
https://knowyourmeme.com/memes/where-is-your-god-now,https://i.kym-cdn.com/entries/icons/original/000/001/851/Screenshot_4.jpg,"""Where Is Your God Now?"" is a popular catchphrase often used as a caption for cursed or menacing images or pictures that depict something defying the normal order of things. The meme originates from a viral YTMND page of the King from Burger King advertisements in the 2000s. The phrase has also been repurposed as the ""Where Is Your X Now?"" snowclone.","The slightly altered version of the phrase appears in verse 7:10 of the Book of Micah of the Old Testament (seen below).[1] Then my enemy will see, and shame will cover her who said to me, “Where is the LORD your God?” My eyes will look upon her; now she will be trampled down like the mire of the streets. The phrase ""Where Is the Lord your God?"" is generally interpreted as ""the enemy"" (the Chaldean) luring the city of Jerusalem into questioning its faith in Jehovah when Jehovah did not aid the city as it was attacked by the Chaldeans.[2][3] Versions of the phrase also appear in the Bible, in Torah and in a number of Psalms, typically said by Israel's enemies to the people of Israel about their God (shown below).[4] My tears have been my food day and night, while they continually say to me, “Where is your God?” (Psalm 42:1-3) He will say: Where are their gods, their rock in whom they trusted, which ate the fat of their sacrifices and drank the wine of their drink offerings? (Deuteronomy 32:36-38) In October 2004, a Burger King commercial called ""Wake Up for With Burger King"" premiered in the U.S. (shown below). In the commercial, a man wakes up to find The Burger King lying next to him and staring at him. On March 28th, 2005, YTMBD[5] user ilpadrino created a YTMND titled ""WHERE IS YOUR GOD NOW?"" that featured a still image of The Burger King staring at the man, captioned with the phrase. The page received nearly 80,000 views in 16 years (still image shown below).","['catchphrase', 'where is your god now', 'snowclone', 'bible', 'demotivational poster', 'god', 'phrase', 'ytmnd']",2005,2021-05-09,['catchphrase']
https://knowyourmeme.com/memes/if-you-watch-x-backwards-its-about-y,https://i.kym-cdn.com/entries/icons/original/000/001/372/rambo.jpg,"If You Watch X Backwards, It's About Y is a snowclone template often seen on online message boards, to change the narrative of a popular films using reverse chronology. It is used to highlight the hilarious or ridiculous aspects of the movie or comment on traditional cinematic and narrative conventions.","One of the earliest instances of flipping a movie's narrative appeared on the SomethingAwful forums[6] on May 20th, 2006 and linked on the Discarded Lies forum on May 21st, 2006.[5] The original post re-imagined Star Wars, Titanic, The Lord of the Rings, Batman Begins and Carry on Camping. Several months later, on January 3rd, 2007, the trope appeared in a question on Yahoo! Answers.[1] That June, YouTuber Bigshot210[2] uploaded an edited montage of Jaws arranged in reverse chronology. The description was nearly word for word from the Yahoo! Answers question, reading: ""The story of a shark who throws-up humans until they open the beach."" The video has since been removed due to a copyright claim by NBC Universal.","['movies', 'film', 'cinema', 'reverse', 'chronology', 'snowclone', 'jaws', 'karate kid', 'rambo', 'reddit', 'carry on camping', 'sixdoublefive321', 'mental floss']",2009,2021-03-27,[]
https://knowyourmeme.com/memes/inb4--2,https://i.kym-cdn.com/entries/icons/original/000/001/325/in-b4-404.jpg,"In before X, often abbreviated as ""in b4,"" is an expression commonly used on discussion forums and imageboards to forecast an anticipated response or a predictable outcome within a given thread.","The phrasal template ""In before X"" is derived from its earlier form of expression ""in before the lock,"" which was widely used on 4chan and other imageboards to leave a marking in a thread that is soon to be cycled out without being archived or removed by the admin. The earliest Urban Dictionary definitions[1][2] for the expressions ""in before the lock"" and ""in b4"" were posted on March 9th, 2006 and April 30th, 2007, respectively. The earliest archived mention of ""in b4"" can be found in a 4chan thread[3] posted on March 31st, 2007, although its usage most likely predates this.","['4chan', 'internet', 'slang', 'in', 'b4', 'forum', 'inb4', '404', 'lock', 'comment', 'comments', 'acronym', 'initialism']",2007,2020-05-21,['slang']
https://knowyourmeme.com/memes/no-items-fox-only-final-destination,https://i.kym-cdn.com/entries/icons/original/000/000/708/Screen_Shot_2017-08-29_at_3.35.06_PM.jpg,"No Items, Fox Only, Final Destination is a catchphrase parodying the strict and ""serious"" behavior of competitive players of the video game series Super Smash Bros., or ""Tourneyfags,"" as they are known. The memetic phrase was turned into a series of MS Paint comics on 4chan in which these players interrupt other events. The phrase is commonly edited through the snowclone ""No X, Y Only, Final Destination!""","In competitive Super Smash Bros. Melee, common tournament tier lists regularly rank the character Fox McCloud as the top rank, currently occupying his own special rank of SS over the 25 other characters.[1] This is commonly attributed to Fox's high levels of versatility and speed, and is commonly proven to be a ""jack of all trades, master of many."" This makes Fox a very popular character among tournament players, making high level tournament play include an overabundance of Fox, oftentimes creating an impression that Fox is the only character allowed to be played. In competitive tournament play, the focus on skill over random chance and environmental exploitation oftentimes leads players to turn off randomly spawning items and impose self restrictions on many stages that provide any form of significant hazard banned from being played at events due to the unbalanced nature of the game. One of the most balanced stages in the game is Final Destination, which is simply a flat panel. These rules commonly leak into Casual Play, where open Stage Selection and Items are normally welcome, creating tension between the casual and tournament player.","['final destination', 'super smash bros', 'fox', 'comic']",2007,2021-01-09,['pop-culture-reference']
https://knowyourmeme.com/memes/at-first-i-was-like-but-then-i-was-like,https://i.kym-cdn.com/entries/icons/original/000/000/324/At_First_I_Was_Like_But_Then_I_Was_Like_Banner'.jpg,"At First, I Was Like, But Then, I Was Like refers to a phrasal template and series of memes that revolve around one's sudden change in their opinion or impression regarding a particular subject. Typically, these appear as image macros with variations of the caption “At first I was like X, but then I was like X,” with two related images depicting different facial expressions split into two panels. There are many variations of the setup, which sometimes displays the same image twice for irony.","The exact origins of this meme are unknown, but it is believed to have originated sometime around 2004. One such early example was posted on April 5th, 2004, in a thread on the My350Z[1] forums by user 12SecZ, who used the phrasal template alongside emoticons to show their reaction (seen below, left). Another early template setup using the phrase in a meme format included the caption ""At first I was like, but then I lol'd."" On May 27th, 2007, MyConfinedSpace[2] user Panzer posted one such example, receiving 24 votes and a 4.5 out of 5 rating in roughly 14 years (seen below, right).","[""serious'd"", ""lol'd"", 'image macro', 'reaction image', 'at first i was like', 'but then i was like', 'snowclone', 'phrasal template', 'meme', 'catchphrase', 'reaction']",2004,2021-05-12,"['catchphrase', 'image-macro', 'reaction']"
https://knowyourmeme.com/memes/imminent-ned-brace-yourselves-winter-is-coming,https://i.kym-cdn.com/entries/icons/original/000/007/146/nedstark.jpg,"Imminent Ned (also know as ""Winter is Coming"") is an image macro series featuring the character Eddard ""Ned"" Stark from the HBO series Game of Thrones, a television adaption of George R. R. Martin's epic fantasy novel series A Song of Ice and Fire. Its snowclone template ""Brace Yourselves, X is Coming"" can be versatilely used to forewarn or proclaim the impending arrival of a highly anticipated event, a product or an internet meme.","In George R. R. Martin's A Song of Ice and Fire, the phrase ""winter is coming"" is prominently featured as the motto of House Stark of Winterfell, a noble clan renowned for its fortified ancient castle. It was also used in the HBO series Game of Thrones as the title of the pilot episode, which aired on April 17th, 2011, as well as for several promotional trailers and posters. An image macro featuring a photo of an owl and the phrase ""winter is coming"" (shown below, left) was submitted to Quickmeme[1] in July 2011, but the phrase didn't take off until it was paired with an HBO promotional portrait of Ned Stark (played by Sean Bean) later in August that year. The earliest known instance using this image (shown below, right) surfaced shortly after the U.S. East Coast earthquake on August 23rd, 2011.","['game of thrones', 'ned stark', 'imminent', 'ned', 'stark', 'brace yourself', 'blacklist', 'snowclone']",2011,2021-04-29,"['image-macro', 'pop-culture-reference']"
